QuestionNum,Question,Answer,exp,subjectId,date
1,Have you eaten anything since our last meal? ,Not at all,HRV,HRV_0265,2022-11-30 20:08:00
2,How often do you work out?,Rarely,HRV,HRV_0265,2022-11-30 20:08:00
3,How would you best describe your current diet?,I do not pay attention to what I eat,HRV,HRV_0265,2022-11-30 20:08:00
4,"We want to check that you are paying attention, please select ""Moderately"" as your answer.",Moderately,HRV,HRV_0265,2022-11-30 20:08:00
5,How tired do you feel?,Very,HRV,HRV_0265,2022-11-30 20:08:00
6,How strong is your desire to eat right now?,Slightly,HRV,HRV_0265,2022-11-30 20:08:00
7,How much do you think you could eat right now?,A moderate size snack,HRV,HRV_0265,2022-11-30 20:08:00
