Answer,C_Pay,Question,QuestionNum,jitter,C_Trial,C_QPresent,rsp,C_SWK,C_SWK_rt,C_TrialEnd,exp,subjectId,date
"A peanut is a legume, not a nut",4,What type of food is a peanut?,447,0.659,0,4011.199999988079,p,K,3005.7000000029802,8194.29999999702,HRV,HRV_0237,2022-11-30 19:11:32
Cricket,3,"What sport used the term ""home run"" long before baseball?  ",260,0.701,1,8194.29999999702,q,S,4618.70000000298,14051.79999999702,HRV,HRV_0237,2022-11-30 19:11:32
"Cle(a)veland, Ohio",5,The name of which city permanently lost its first 'a' when the first issue of a newspaper was published in 1831 and they had to shorten it to fit on the paper's masthead?,102,0.526,2,14051.79999999702,q,S,7275.20000000298,22375.0,HRV,HRV_0237,2022-11-30 19:11:32
It causes sour foods subsequently consumed to taste sweet. ,1,Why is the Synsepalum dulcificum berry called the miracle fruit?,464,1.685,3,22375.09999999404,q,S,4199.70000000298,28792.89999999106,HRV,HRV_0237,2022-11-30 19:11:32
Prussian Blue ,7,What craylola color became 'midnight blue' in 1985 to remove an out-of-date geographical term? ,160,0.988,4,28793.0,q,S,5102.0,35410.79999999702,HRV,HRV_0237,2022-11-30 19:11:32
Orville Wright,5,Who was flying the plane in which the first US airplane fatality occurred? ,377,1.572,5,35410.79999999702,q,S,4571.899999991059,42090.5,HRV,HRV_0237,2022-11-30 19:11:32
George H.W. Bush ,5,"Who said: ""I'm the president of the United States and I'm not going to eat any more broccoli""? ",415,1.48,6,42090.59999999404,q,S,3317.2000000029802,47407.19999998808,HRV,HRV_0237,2022-11-30 19:11:32
Peanuts ,3,What snack food is an ingredient in the explosive dynamite?  ,408,1.604,7,47407.29999999702,q,S,4319.399999991059,53866.69999998808,HRV,HRV_0237,2022-11-30 19:11:32
Bile,7,"Two of the ""four humors"" the ancients believed controlled temperament consist of what bodily fluid?",118,1.144,8,53866.79999999702,q,S,4184.399999991059,59713.39999999106,HRV,HRV_0237,2022-11-30 19:11:32
Fiber is the gut bacteria's preferred fuel source. ,6,What food is most beneficial for your gut bacteria?,458,1.515,9,59713.39999999106,p,K,5580.0,67334.39999999106,HRV,HRV_0237,2022-11-30 19:11:32
Lolita by Vladimir Nabokov,5,"""Don't Stand So Close to Me"" by the Police was inspired by what literary work?",3,0.809,10,67334.5,q,S,3271.199999988079,71933.09999999404,HRV,HRV_0237,2022-11-30 19:11:32
Egypt,1,"In what country would you find the port of Rosetta, of Rosetta Stone fame?  ",63,1.013,11,71933.09999999404,q,S,4078.0999999940395,77545.79999999702,HRV,HRV_0237,2022-11-30 19:11:32
Owl,5,"Which animal has tubular shaped eyeballs, which therefore cannot move?  ",325,1.255,12,77545.79999999702,q,S,4920.0,84253.09999999404,HRV,HRV_0237,2022-11-30 19:11:32
popscicle,6,What food was invented by an 11 year old in 1905?,450,0.77,13,84253.19999998808,q,S,2696.4000000059605,88244.29999999702,HRV,HRV_0237,2022-11-30 19:11:32
The budgerigar,1,"What pet bird takes its name from Australian Aborigine words for ""good eating""?",244,0.652,14,88244.29999999702,q,S,4403.20000000298,93821.29999999702,HRV,HRV_0237,2022-11-30 19:11:32
South America,4,The electric eel is native only to what continent?,96,0.55,15,93821.39999999106,q,S,3885.5,98779.09999999404,HRV,HRV_0237,2022-11-30 19:11:32
Bling bling ,5,What term does rapper B.G. say he wishes he'd patented when he used it for the title of his massive 1999 hit?,264,0.693,16,98779.09999999404,q,S,6410.5,106400.29999999702,HRV,HRV_0237,2022-11-30 19:11:32
coca-cola,7,Which famous soft drink was invented in 1892?,425,1.273,17,106400.29999999702,p,K,2579.8999999910593,110775.0,HRV,HRV_0237,2022-11-30 19:11:32
a spit,7,"If something is described as rotisserie, what has it been cooked on?",428,1.476,18,110775.0,q,S,5652.5,118432.5,HRV,HRV_0237,2022-11-30 19:11:32
A Hawaiian goose,5,What is a nene?,195,1.283,19,118432.5,q,S,3221.8999999910593,123478.5,HRV,HRV_0237,2022-11-30 19:11:32
Juvenile deliquent,6,What did popular author J.D. Salinger reveal the first two intials in his name to stand for?  ,163,1.462,20,123478.59999999404,q,S,3646.5999999940395,129107.5,HRV,HRV_0237,2022-11-30 19:11:32
Your blind spot,6,What's the more common name for the retinal scotoma caused by the optic nerve? ,303,1.034,21,129107.5,q,S,4860.29999999702,135524.29999999702,HRV,HRV_0237,2022-11-30 19:11:32
Sepia,6,What tinting process for black and white photography was named for the genus of cuttlefish that originally provided the pigment?,266,0.835,22,135524.29999999702,q,S,6455.0999999940395,143329.79999999702,HRV,HRV_0237,2022-11-30 19:11:32
Charles ,4,What river runs through Boston? ,252,0.768,23,143329.79999999702,q,S,2774.5999999940395,147404.79999999702,HRV,HRV_0237,2022-11-30 19:11:32
Ostrich,1,Which animal's eyes are bigger than its brain?   ,327,1.322,24,147404.79999999702,q,S,3095.7999999970198,152356.79999999702,HRV,HRV_0237,2022-11-30 19:11:32
As Good As It Gets ,3,"What Jack Nicholson comedy was translated as ""Mr. Cat Poop"" in Cantonese when it was released in China?",218,0.757,25,152356.79999999702,q,S,4373.5999999940395,158003.09999999404,HRV,HRV_0237,2022-11-30 19:11:32
Hong Kong ,7,What city's harbor is overlooked by Victoria Peak? ,185,1.842,26,158003.09999999404,q,S,1668.7000000029802,162040.89999999106,HRV,HRV_0237,2022-11-30 19:11:32
Coca-Cola,4,"""Project Kansas"" was the name for the top secret 1985 attempt to revamp what product?",416,0.813,27,162040.89999999106,q,S,2556.2999999970198,165935.69999998808,HRV,HRV_0237,2022-11-30 19:11:32
citrus fruit (scurvy is caused by a lack of vitamin c),7,Sailors used to suffer from a horrible illness called scurvy. Which food prevents scurvy?,441,1.475,28,165935.79999999702,q,S,4375.5999999940395,172306.5,HRV,HRV_0237,2022-11-30 19:11:32
Choking on food,3,"Each year, approximately 125 people die of what? ",417,0.793,29,172306.5,q,S,1899.5999999940395,175516.5,HRV,HRV_0237,2022-11-30 19:11:32
Yahoo!,3,What Internet portal was sued for copyright infringement in 2000 by the star of Young Einstein? ,190,0.539,30,175516.5,q,S,4097.29999999702,180677.5,HRV,HRV_0237,2022-11-30 19:11:32
Italy ,7,What country borders both of the world's only two nations with square flags? ,157,0.744,31,180677.5,q,S,3936.199999988079,185879.29999999702,HRV,HRV_0237,2022-11-30 19:11:32
Marven (Marvin) Gardens,2,"What Margate City, NJ, housing area has been misspelled on the Monopoly board for almost 80 years?",229,1.846,32,185879.29999999702,q,S,6442.5,194694.29999999702,HRV,HRV_0237,2022-11-30 19:11:32
Pressure,6,What is measured in millibars? ,202,0.68,33,194694.29999999702,q,S,2497.2999999970198,198392.09999999404,HRV,HRV_0237,2022-11-30 19:11:32
Canada,1,What's the only country to have hosted a Summer Olympics in which it didn't win a single medal?   ,308,1.28,34,198392.09999999404,q,S,3660.7999999970198,203860.59999999404,HRV,HRV_0237,2022-11-30 19:11:32
Pearl Harbor ,3,What late-breaking news story kicked Dumbo off the cover of Time magazine six weeks after the elephant cartoon's release?,227,0.615,35,203860.59999999404,q,S,7060.5,212058.29999999702,HRV,HRV_0237,2022-11-30 19:11:32
Apples. They don't have caffeine but the natural sugar and vitamins release slowly and make you feel more awake. ,6,Whice fruit is effective than coffee at waking you up in the morning?,454,1.02,36,212058.29999999702,q,S,4390.899999991059,217990.69999998808,HRV,HRV_0237,2022-11-30 19:11:32
Espresso,6,The Italian government regulates the price of what beverage?,399,0.836,37,217990.79999999702,q,S,3863.7000000029802,223219.5,HRV,HRV_0237,2022-11-30 19:11:32
Luge,6,What sports term is the shortest word ever to decide the National Spelling Bee?   ,261,1.822,38,223219.5,q,S,4784.0,230354.69999998808,HRV,HRV_0237,2022-11-30 19:11:32
Avocado,3,Pet parrots can eat most human foods except chocolate and which pitted food?  ,398,1.262,39,230354.79999999702,q,S,6226.0999999940395,238362.29999999702,HRV,HRV_0237,2022-11-30 19:11:32
Radar,6,What was developed thanks to Christian Hulsmeyer's 1904 invention of the telemobiloscope?  ,275,1.113,40,238362.29999999702,q,S,3354.7000000029802,243345.39999999106,HRV,HRV_0237,2022-11-30 19:11:32
Cockroach,5,What animal can live up to a week without its head?,131,1.533,41,243345.39999999106,p,K,4323.70000000298,249738.69999998808,HRV,HRV_0237,2022-11-30 19:11:32
A sneeze,5,The air expelled from what can travel at 100 mph?,90,1.331,42,249738.79999999702,q,S,2348.7000000029802,253950.29999999702,HRV,HRV_0237,2022-11-30 19:11:32
State quarters ,4,What's been released five times a year from January 1999 to fall 2008?,300,1.149,43,253950.29999999702,q,S,4281.899999991059,259900.0,HRV,HRV_0237,2022-11-30 19:11:32
Traffic lights,4,"Thimpu, the capital of Bhutan, is known for being the only world capital without any what?",113,1.819,44,259900.0,q,S,6030.79999999702,268274.89999999106,HRV,HRV_0237,2022-11-30 19:11:32
Nutmeg,3,What slightly hallucinogenic spice did Malcolm X use to get high while in prison? ,407,0.568,45,268274.89999999106,q,S,3169.2999999970198,272549.5,HRV,HRV_0237,2022-11-30 19:11:32
Columbus Circle ,7,What Manhattan intersection was America's first traffic circle?,228,0.901,46,272549.5,q,S,2662.2999999970198,276645.1999999881,HRV,HRV_0237,2022-11-30 19:11:32
Australia,7,What country has six sheep for every human? ,158,1.185,47,276645.1999999881,q,S,1842.4000000059605,280199.799999997,HRV,HRV_0237,2022-11-30 19:11:32
All in the Family ,3,"What's the only TV show to top the Nielsen ratings five seasons in a row, from 1972 to 1976?  ",311,1.602,48,280199.799999997,q,S,4398.79999999702,286732.1999999881,HRV,HRV_0237,2022-11-30 19:11:32
Dragees,7,"What are the sugared almonds, traditionally thrown over the bride and groom at a wedding, called?",430,1.833,49,286732.1999999881,q,S,5086.70000000298,294188.59999999404,HRV,HRV_0237,2022-11-30 19:11:32
A wiki,3,"What kind of information resource takes its name from a Hawaiian word for ""quick""? ",225,1.784,50,294188.59999999404,q,S,3696.5999999940395,300204.6999999881,HRV,HRV_0237,2022-11-30 19:11:32
Lhasa Apso,3,"What is called the ""bark lion sentinel dog"" in its native Tibet?  ",200,1.481,51,300204.799999997,p,K,6583.20000000298,308791.1999999881,HRV,HRV_0237,2022-11-30 19:11:32
The Hindenburg explosion,6,"What event inspired Herbert Morrison's famous quote ""Oh, the humanity!""?",174,1.694,52,308791.1999999881,q,S,3145.6000000089407,314165.1999999881,HRV,HRV_0237,2022-11-30 19:11:32
Oregon ,3,"The world's smallest park, measuring two feet in diameter, is located in what U.S. state? ",112,1.637,53,314165.1999999881,q,S,3009.1000000089407,319344.89999999106,HRV,HRV_0237,2022-11-30 19:11:32
Bright red,6,Vitamin A is largely available in natural food sources with which colour?,448,0.783,54,319345.0,q,S,6558.5,327220.0,HRV,HRV_0237,2022-11-30 19:11:32
There was a pound of every ingredient in the original reciipe. ,1,How did the pound cake get its name?,460,0.69,55,327220.0,q,S,2101.2999999970198,330529.09999999404,HRV,HRV_0237,2022-11-30 19:11:32
Tears,7,"At 6-8 weeks, babies start producing what? ",23,1.566,56,330529.09999999404,q,S,3491.2000000029802,336122.39999999106,HRV,HRV_0237,2022-11-30 19:11:32
chickpeas,4,What is used to make hummus?,424,1.335,57,336122.39999999106,p,K,2746.2999999970198,340734.89999999106,HRV,HRV_0237,2022-11-30 19:11:32
Sugar-sweetened beverages are likely the most fattening becaause they are not registered as consumed calories. ,3,What is the most fattening product in the modern diet?,457,1.992,58,340734.89999999106,q,S,2661.9000000059605,345932.799999997,HRV,HRV_0237,2022-11-30 19:11:32
San Fancisco,5,"""Dear Abby"" first appeared in a newspaper of what city?",2,1.283,59,345932.799999997,q,S,3887.3999999910593,351650.09999999404,HRV,HRV_0237,2022-11-30 19:11:32
France,5,"What country launched Europe's first super-high-speed passenger train, in 1981?",159,1.064,60,351650.09999999404,q,S,3196.9000000059605,356440.799999997,HRV,HRV_0237,2022-11-30 19:11:32
Happy Birthday,4,What was the first song ever performed in outer space? ,285,1.682,61,356440.799999997,q,S,1730.2000000029802,360377.89999999106,HRV,HRV_0237,2022-11-30 19:11:32
The Commodore 64 ,6,What 1982 successor to the VIC-20 is still the bestselling computer model of all time?,124,1.528,62,360378.0,q,S,3368.0999999940395,365806.299999997,HRV,HRV_0237,2022-11-30 19:11:32
Asparagus,5,what vegetable loses its flavour the quickest?,451,1.956,63,365806.39999999106,q,S,2236.7999999970198,370535.5,HRV,HRV_0237,2022-11-30 19:11:32
The Chesapeake Bay,7,What bay is actually the United States's largest tidal estuary? ,141,0.852,64,370535.5,q,S,3874.7999999970198,375779.0,HRV,HRV_0237,2022-11-30 19:11:32
The popsicle,1,Which popular treat was invented by an 11-year-old in California? ,413,0.891,65,375779.0,q,S,3102.0,380285.59999999404,HRV,HRV_0237,2022-11-30 19:11:32
Oxygen,7,"By a wide margin (more than 3:2), what's the most abundant element in the Earth's crust?",28,1.603,66,380285.59999999404,q,S,4077.0,386505.89999999106,HRV,HRV_0237,2022-11-30 19:11:32
cheese ,5,What item of food holds the world record for being the most stolen item of food in the world?,444,1.701,67,386505.89999999106,q,S,4845.70000000298,393588.5,HRV,HRV_0237,2022-11-30 19:11:32
Butt,4,The adjective callipygian refers to someone who has a beautiful what? ,88,0.969,68,393588.5,q,S,4189.5,399266.6999999881,HRV,HRV_0237,2022-11-30 19:11:32
Broccoli! ,3,Whice vegeteable has more vitamin C than an orange and as much calcium as whole milk?,456,1.656,69,399266.6999999881,q,S,4820.4000000059605,406263.6999999881,HRV,HRV_0237,2022-11-30 19:11:32
Violin,3,What instrument was invented to sound like a human singing? ,189,1.95,70,406263.6999999881,q,S,2543.6000000089407,411274.89999999106,HRV,HRV_0237,2022-11-30 19:11:32
United States,3,In which country is it most common for divers to be attacked by sharks?,68,0.624,71,411274.89999999106,q,S,2602.2999999970198,415030.89999999106,HRV,HRV_0237,2022-11-30 19:11:32
Saffron,7,What is the most expensive spice (by weight) in the world?,431,1.31,72,415031.0,q,S,1733.0999999940395,418591.299999997,HRV,HRV_0237,2022-11-30 19:11:32
The guppy,1,What common aquarium fish is named for the naturalist who discovered it in Trinidad in 1876? ,152,0.561,73,418591.299999997,q,S,2622.5,422300.59999999404,HRV,HRV_0237,2022-11-30 19:11:32
Coca-cola,5,What popular drink was first marketed as a brain tonic?,405,1.448,74,422300.59999999404,p,K,2448.5999999940395,426712.89999999106,HRV,HRV_0237,2022-11-30 19:11:32
Gary Busey,1,What actor campaigned against helmet laws until he was almost killed in a helmetless 1988 motorcycle accident?,127,0.84,75,426712.89999999106,q,S,5069.9000000059605,433152.89999999106,HRV,HRV_0237,2022-11-30 19:11:32
Belgium,5,Where were French fries invented?,437,1.059,76,433152.89999999106,p,K,3585.4000000059605,438313.59999999404,HRV,HRV_0237,2022-11-30 19:11:32
Habanero,4,What chili pepper was believed the hottest in the world until the Naga Jolokia pepper was discovered in India in 2000?,401,1.876,77,438313.59999999404,p,K,5698.4000000059605,446420.299999997,HRV,HRV_0237,2022-11-30 19:11:32
Grover Cleveland ,3,Who was the only U.S. president to have been married in the White House? ,385,0.843,78,446420.299999997,q,S,2410.3999999910593,450200.09999999404,HRV,HRV_0237,2022-11-30 19:11:32
Ian Thorpe ,5,Who outgrew a childhood chlorine allergy to become the biggest Olympic medal winner in Australian history? ,370,1.262,79,450200.1999999881,q,S,3720.0,455716.0,HRV,HRV_0237,2022-11-30 19:11:32
The Discovery,7,Which space shuttle is named for the ship on which Robert Scott first sailed to Antarctica? ,352,1.08,80,455716.0,q,S,3117.699999988079,460440.1999999881,HRV,HRV_0237,2022-11-30 19:11:32
Oliver!,2,What's the only Best Picture Oscar winner whose title ends with an exclamation point?  ,306,0.897,81,460440.299999997,q,S,5680.29999999702,467539.09999999404,HRV,HRV_0237,2022-11-30 19:11:32
The Millenium Falcon ,3,"What could be built by the largest Lego set ever sold, a 5195-piece monstrosity? ",156,1.606,82,467539.09999999404,q,S,4577.79999999702,474257.39999999106,HRV,HRV_0237,2022-11-30 19:11:32
Ripe cranerries bounce when dropped on the ground,1,How do farmers test whether cranberries are ripe?,452,0.722,83,474257.5,q,S,3844.7999999970198,479355.299999997,HRV,HRV_0237,2022-11-30 19:11:32
Death,2,"In ancient Egypt, what was the penalty for killing a cat?",58,0.99,84,479355.299999997,q,S,2210.7999999970198,483082.299999997,HRV,HRV_0237,2022-11-30 19:11:32
Cayenne pepper ,2,What spice is named for the capital of French Guiana? ,409,1.956,85,483082.299999997,q,S,1559.5999999940395,487128.6999999881,HRV,HRV_0237,2022-11-30 19:11:32
Bhutan,6,"Thimpu, the world's only capital city with no traffic lights, is the capital of what tiny kingdom?",114,1.186,86,487128.6999999881,q,S,5516.800000011921,494365.39999999106,HRV,HRV_0237,2022-11-30 19:11:32
OutKast,1,Who was sued in 1999 by Rosa Parks after they used her name to title a hit song?  ,379,1.959,87,494365.39999999106,p,K,6724.5,503577.0,HRV,HRV_0237,2022-11-30 19:11:32
New York,4,Which state has the zip code 12345?,354,1.153,88,503577.09999999404,q,S,2402.7999999970198,507656.89999999106,HRV,HRV_0237,2022-11-30 19:11:32
potein,4,"What nutrient comes from meat, eggs, and fish?",433,1.312,89,507657.0,p,K,2459.199999988079,511958.59999999404,HRV,HRV_0237,2022-11-30 19:11:32
Strom Thurmond ,6,Who filibustered for a record twenty-four hours and eighteen minutes -- with a urine pail standing at the ready -- in the hope of preventing the Civil Rights Act of 1957?,366,1.068,90,511958.59999999404,,,,521486.5,HRV,HRV_0237,2022-11-30 19:11:32
8 Mile Road ,2,"What road, which names a 2002 film, divides Wayne County from affluent Oakland and Maycomb Counties?",254,0.526,91,521486.5,q,S,4280.5,526817.1999999881,HRV,HRV_0237,2022-11-30 19:11:32
Odor Eaters ,6,What product did Herbert Lapidus invent in 1974 by impregnanting latex rubber with coconut charcoal?,248,1.193,92,526817.1999999881,q,S,7099.4000000059605,535626.599999994,HRV,HRV_0237,2022-11-30 19:11:32
Midnight Cowboy ,5,What was the only X-rated film to win the Academy Award for Best Picture?  ,293,1.364,93,535626.599999994,q,S,2657.5999999940395,540185.799999997,HRV,HRV_0237,2022-11-30 19:11:32
Gone with the Wind,1,The first swear word on the big screen was in what movie?,100,1.26,94,540185.799999997,q,S,3486.7000000029802,545454.599999994,HRV,HRV_0237,2022-11-30 19:11:32
Quotations ,3,What did the letter Q originally stand for in NASDAQ?  ,165,1.742,95,545454.599999994,q,S,2458.7999999970198,550181.5,HRV,HRV_0237,2022-11-30 19:11:32
Tea leaves,2,Tasseomancy is a method of fortune telling that primarily uses what? ,418,1.171,96,550181.5,q,S,3857.5999999940395,555743.5,HRV,HRV_0237,2022-11-30 19:11:32
Cornea,5,What is the only part of the body that has no blood supply? ,211,1.925,97,555743.5,q,S,2951.199999988079,561143.3999999911,HRV,HRV_0237,2022-11-30 19:11:32
Equal Employment Opportunity Commission ,7,"What federal agency, which targets workplace discrimination, was chaired by Clarence Thomas for most of the 1980s?",176,1.382,98,561143.3999999911,q,S,5429.29999999702,568495.8999999911,HRV,HRV_0237,2022-11-30 19:11:32
Sic semper tyrannis ,4,What state motto of Virginia did John Wilkes Booth shout as he jumped from Lincoln's box to the stage of Ford's Theatre? ,262,0.842,99,568495.8999999911,q,S,6733.600000008941,576596.0,HRV,HRV_0237,2022-11-30 19:11:32
Smoke,2,"in 1908, New York City passed the Sullivan Ordinance which made it illegal for women to do what in public?",52,1.561,100,576596.0,q,S,4878.5,583581.6999999881,HRV,HRV_0237,2022-11-30 19:11:32
Jamaica Bay,5,"What lagoon south of Queens, New York, is named for a local Indian tribe and has nothing to do Caribbean?",226,1.239,101,583581.6999999881,q,S,4290.5,589623.099999994,HRV,HRV_0237,2022-11-30 19:11:32
Bookkeeper,4,What is the only English word with three consecutive double letters?  ,209,1.329,102,589623.099999994,q,S,4739.4000000059605,596229.3999999911,HRV,HRV_0237,2022-11-30 19:11:32
Jose Castro ,6,"What Mexican general, who governed California for four months in 1835, would probably be surprised by how he's remembered in San Francisco today?",231,1.565,103,596229.3999999911,q,S,7637.29999999702,605970.299999997,HRV,HRV_0237,2022-11-30 19:11:32
