Answer,C_Pay,Question,QuestionNum,jitter,C_Trial,C_QPresent,rsp,C_SWK,C_SWK_rt,C_TrialEnd,exp,subjectId,date
"Cle(a)veland, Ohio",3,The name of which city permanently lost its first 'a' when the first issue of a newspaper was published in 1831 and they had to shorten it to fit on the paper's masthead?,102,0.732,131,490937.3000000715,q,S,1672.5,493857.39999997616,HRV,HRV_0260,2022-11-30 19:44:39
Violin,2,What instrument was invented to sound like a human singing? ,189,1.081,132,493857.39999997616,q,S,1728.5,497175.89999997616,HRV,HRV_0260,2022-11-30 19:44:39
Ostrich,7,Which animal's eyes are bigger than its brain?   ,327,1.612,133,497176.0,q,S,1862.7000000476837,501160.8000000715,HRV,HRV_0260,2022-11-30 19:44:39
Equal Employment Opportunity Commission ,1,"What federal agency, which targets workplace discrimination, was chaired by Clarence Thomas for most of the 1980s?",176,0.5,134,501160.8000000715,q,S,1553.0999999046326,503721.2000000477,HRV,HRV_0260,2022-11-30 19:44:39
Coca-Cola,1,"The BBC once banned the Beatles' ""Come Together"" for ""advertising"" what product in the lyrics?",93,0.826,135,503721.3000000715,q,S,1523.3999999761581,506585.39999997616,HRV,HRV_0260,2022-11-30 19:44:39
The evacuation of Saigon,7,"""White Christmas"" playing on Armed Forces Radio was the secret signal for what event on April 30, 1975?",6,1.514,136,506585.5,q,S,1560.3000000715256,510169.3000000715,HRV,HRV_0260,2022-11-30 19:44:39
The Super Bowl ,2,What rubber Wham-O toy inspired the name of one of the world's largest sporting events? ,255,1.282,137,510169.3000000715,q,S,1693.0,513656.39999997616,HRV,HRV_0260,2022-11-30 19:44:39
Frog,2,Certain types of which animal can be frozen solid and then continue living once thawed?,30,0.819,138,513656.39999997616,q,S,1889.4000000953674,516880.39999997616,HRV,HRV_0260,2022-11-30 19:44:39
It sits beside the Finger Lakes ,3,"Why is Oneida Lake, near Syracuse, New York, sometimes called ""the thumb""?",393,1.701,139,516880.39999997616,q,S,2185.4000000953674,521272.5,HRV,HRV_0260,2022-11-30 19:44:39
Holy Roman Emperor Henry IV ,3,Who did Pope Gregory VII leave in the snow outside of his castle gates for three full days?  ,365,1.512,140,521272.5,q,S,1523.3999999761581,524817.8999999762,HRV,HRV_0260,2022-11-30 19:44:39
Butt,1,The adjective callipygian refers to someone who has a beautiful what? ,88,0.992,141,524817.8999999762,q,S,1655.9000000953674,527977.2000000477,HRV,HRV_0260,2022-11-30 19:44:39
Mushrooms which have been exposed to light,3,What is the only non-animal natural source of vitamin D?,459,0.729,142,527977.2000000477,q,S,1864.6000000238419,531081.5,HRV,HRV_0260,2022-11-30 19:44:39
Benjamin Franklin ,6,"Who carried hundreds of imported books in his Philadelphia shop in the 1730s, the same decade in which he started America's first lending library?",362,1.997,143,531081.5,q,S,1780.8000000715256,535367.8999999762,HRV,HRV_0260,2022-11-30 19:44:39
Russia,4,Which country has the most public libraries?  ,339,1.387,144,535367.8999999762,q,S,1761.9000000953674,539024.1000000238,HRV,HRV_0260,2022-11-30 19:44:39
The Chesapeake Bay,3,What bay is actually the United States's largest tidal estuary? ,141,1.657,145,539024.1000000238,q,S,1577.7000000476837,542768.3000000715,HRV,HRV_0260,2022-11-30 19:44:39
Pandemonium,1,"What noisy word comes from the capital of Hell in Milton's ""Paradise Lost""? ",239,1.238,146,542768.3000000715,q,S,1857.5,546368.0,HRV,HRV_0260,2022-11-30 19:44:39
Mung beans ,4,What kind of bean produces the Asian-style bean sprouts in the produce section of supermarkets? ,404,1.467,147,546368.0,q,S,1897.8999999761581,550249.3000000715,HRV,HRV_0260,2022-11-30 19:44:39
"The code is ""SUX"" ",1,Why has Sioux Falls Regional Airport in South Dakota been trying to change its three-letter airport designation for years?,392,0.966,148,550249.3999999762,q,S,2088.5,553817.5,HRV,HRV_0260,2022-11-30 19:44:39
Choking on food,5,"Each year, approximately 125 people die of what? ",417,1.149,149,553817.5,q,S,1557.7000000476837,557033.3999999762,HRV,HRV_0260,2022-11-30 19:44:39
The Leek ,2,"What bulb vegetable is traditionally worn on Saint David's Day, as it's a national symbol of Wales?",145,1.274,150,557033.3999999762,q,S,1720.4000000953674,560537.3999999762,HRV,HRV_0260,2022-11-30 19:44:39
Honey,6,"What food, still edible, was found by archaeologists in the tombs of Egyptian pharaohs? ",402,0.886,151,560537.3999999762,q,S,2352.5,564281.3999999762,HRV,HRV_0260,2022-11-30 19:44:39
The Oxford English Dictionary,7,"W.C. Minor, a murderer, spent the last decades of his life in an insane asylum writing hundreds of entries for what reference work? ",121,1.807,152,564281.3999999762,q,S,1608.5,568208.8000000715,HRV,HRV_0260,2022-11-30 19:44:39
The paper clip,7,"""Gem"" is the trade name for the most common, three-loop design of what?",4,1.464,153,568208.8000000715,q,S,1633.0,571825.6000000238,HRV,HRV_0260,2022-11-30 19:44:39
Francisco Goya,3,"After a fever took his hearing, who painted his bleak ""Black Paintings"" in a house called Quinta del Sordo, Spanish for ""House of the Deaf Man""?",15,0.608,154,571825.6000000238,q,S,1888.2000000476837,574832.8999999762,HRV,HRV_0260,2022-11-30 19:44:39
coca-cola,4,Which famous soft drink was invented in 1892?,425,1.111,155,574833.0,q,S,1544.5,578001.3999999762,HRV,HRV_0260,2022-11-30 19:44:39
South America,1,The electric eel is native only to what continent?,96,1.367,156,578001.3999999762,q,S,2320.4000000953674,582193.3999999762,HRV,HRV_0260,2022-11-30 19:44:39
Throat,2,Where in the human body is the only bone that is not jointed to another?  ,317,1.809,157,582193.3999999762,q,S,1864.4000000953674,586384.7000000477,HRV,HRV_0260,2022-11-30 19:44:39
Echinoderms,1,"Starfish belong to what animal phylum, whose name means ""spiny skin""? ",85,1.12,158,586384.7000000477,q,S,1737.0,589753.3999999762,HRV,HRV_0260,2022-11-30 19:44:39
Social Security,3,Ida May Fuller was the first U.S. citizen to receive a check for what?,46,1.277,159,589753.3999999762,q,S,2040.5,593585.2000000477,HRV,HRV_0260,2022-11-30 19:44:39
Eric the Red,7,"According to Norse sagas, who gave Greenland its misleading name in order to attract settlers? ",12,0.954,160,593585.2000000477,q,S,1648.6999999284744,596704.7000000477,HRV,HRV_0260,2022-11-30 19:44:39
Czechoslovakia,2,Shirley Temple Black was the U.S. ambassador to what nation at the time of its 1989 revolution?,83,1.337,161,596704.7000000477,q,S,1585.0,600135.8000000715,HRV,HRV_0260,2022-11-30 19:44:39
