QuestionNum,Question,Answer,exp,subjectId,date
1,Have you eaten anything since our last meal? ,Not at all,HRV,HRV_0241,2022-11-30 19:38:54
2,How often do you work out?,Almost daily,HRV,HRV_0241,2022-11-30 19:38:54
3,How would you best describe your current diet?,Not strict but generally try to maintain healthy diet,HRV,HRV_0241,2022-11-30 19:38:54
4,"We want to check that you are paying attention, please select ""Moderately"" as your answer.",Moderately,HRV,HRV_0241,2022-11-30 19:38:54
5,How tired do you feel?,Slightly,HRV,HRV_0241,2022-11-30 19:38:54
6,How strong is your desire to eat right now?,Slightly,HRV,HRV_0241,2022-11-30 19:38:54
7,How much do you think you could eat right now?,A light snack,HRV,HRV_0241,2022-11-30 19:38:54
