Answer,C_Pay,Question,QuestionNum,jitter,C_Trial,C_QPresent,rsp,C_SWK,C_SWK_rt,C_AnswerPresent,C_WorthPresent,C_Worth,C_Worth_rt,C_TrialEnd,exp,subjectId,date
Mushrooms which have been exposed to light,4,What is the only non-animal natural source of vitamin D?,459,0.754,0,3126.0,t,W,5189.100000008941,10850.40000000596,14863.20000000298,3,2469.0,18594.20000000298,HRV,HRV_0122,2022-11-30 18:02:34
J,5,What's the only letter that doesn't appear in the periodic table of elements?,309,1.935,1,18594.20000000298,p,K,5385.0999999940395,,,,,26445.29999999702,HRV,HRV_0122,2022-11-30 18:02:34
James Buchanan ,5,Who was the only U.S. president never to be married?,383,0.946,2,26445.40000000596,t,W,4127.70000000298,33099.29999999702,37112.70000000298,3,653.5999999940395,39245.60000000894,HRV,HRV_0122,2022-11-30 18:02:34
Bacon,7,"In Britain, what kind of meat comes in rashers?",397,1.092,3,39245.70000000298,p,K,4280.20000000298,,,,,45135.0,HRV,HRV_0122,2022-11-30 18:02:34
Speed of wind,7,What does an anemometer measure? ,168,0.738,4,45135.0,p,K,4325.79999999702,,,,,50707.5,HRV,HRV_0122,2022-11-30 18:02:34
Twenty-fourth ,1,Which Constitutional Amendment deals with poll taxes? ,335,1.242,5,50707.5,t,W,4847.29999999702,58077.79999999702,62089.10000000894,1,637.5,64502.60000000894,HRV,HRV_0122,2022-11-30 18:02:34
Bright red,1,Vitamin A is largely available in natural food sources with which colour?,448,1.979,6,64502.60000000894,p,K,4786.79999999702,,,,,71804.90000000596,HRV,HRV_0122,2022-11-30 18:02:34
Italy ,1,What country borders both of the world's only two nations with square flags? ,157,1.944,7,71805.0,t,W,4446.29999999702,78763.0,82785.60000000894,3,1441.8999999910593,86683.29999999702,HRV,HRV_0122,2022-11-30 18:02:34
Zinfindel,6,"What grape, used to make a popular California wine, is called Primitivo in Europe?  ",403,1.151,8,86683.29999999702,p,K,3986.1000000089407,,,,,92350.60000000894,HRV,HRV_0122,2022-11-30 18:02:34
The crocodile,7,The Egyptian plover is a bird best known for its symbiotic relationship with what host animal?,95,0.881,9,92350.70000000298,p,K,4062.0,,,,,97806.90000000596,HRV,HRV_0122,2022-11-30 18:02:34
Honda's Civic,7,"After Toyota's Corolla, what coupe introduced in 1972 is the second oldest Japanese car model still on the market?",17,1.821,10,97806.90000000596,p,K,5677.29999999702,,,,,105825.70000000298,HRV,HRV_0122,2022-11-30 18:02:34
The Pope,2,"Currently, only the queen of Spain and Belgium and the grand duchess of Luxembourg hold the privlege of wearing white when they visit whom?",32,1.293,11,105825.79999999702,t,W,7884.20000000298,116242.79999999702,120256.90000000596,1,567.5,122651.60000000894,HRV,HRV_0122,2022-11-30 18:02:34
Vietnam,7,"In what country did the domesticated ""potbellied pig"" originate?",61,1.411,12,122651.60000000894,p,K,4336.29999999702,,,,,128926.10000000894,HRV,HRV_0122,2022-11-30 18:02:34
Pearl Harbor ,4,What late-breaking news story kicked Dumbo off the cover of Time magazine six weeks after the elephant cartoon's release?,227,1.619,13,128926.20000000298,p,K,5803.4000000059605,,,,,136874.20000000298,HRV,HRV_0122,2022-11-30 18:02:34
Betty Rubble,1,Which core Flintstones cast member was absent from Flintstone vitamins until 1996? ,337,0.625,14,136874.20000000298,p,K,4659.79999999702,,,,,142697.40000000596,HRV,HRV_0122,2022-11-30 18:02:34
Adobe,3,"What word for mud bricks comes to us from the ancient Egyptian word ""dbt""? ",298,0.834,15,142697.40000000596,t,W,7280.20000000298,152497.60000000894,156513.0,1,549.2999999970198,158421.40000000596,HRV,HRV_0122,2022-11-30 18:02:34
Coca-Cola,6,"""Project Kansas"" was the name for the top secret 1985 attempt to revamp what product?",416,1.4,16,158421.40000000596,q,S,3766.7000000029802,,,,,164106.90000000596,HRV,HRV_0122,2022-11-30 18:02:34
Avocado,1,Pet parrots can eat most human foods except chocolate and which pitted food?  ,398,1.198,17,164107.0,q,S,5092.5,,,,,170916.29999999702,HRV,HRV_0122,2022-11-30 18:02:34
The Blair Witch Project,7,"What 1990's movie was filmed on a budget of $60,000 but grossed over $100 million? ",125,1.473,18,170916.29999999702,q,S,5265.800000011921,,,,,178193.40000000596,HRV,HRV_0122,2022-11-30 18:02:34
Pen(n)sylvania ,3,What proper name is spelled unusually with a single 'n' both on the Liberty Bell and in the U.S. Constitution? ,249,0.898,19,178193.40000000596,p,K,5599.899999991059,,,,,185208.20000000298,HRV,HRV_0122,2022-11-30 18:02:34
Honey,5,"What food, still edible, was found by archaeologists in the tombs of Egyptian pharaohs? ",402,1.284,20,185208.20000000298,q,S,6411.0,,,,,193416.0,HRV,HRV_0122,2022-11-30 18:02:34
Peanuts ,4,What snack food is an ingredient in the explosive dynamite?  ,408,1.359,21,193416.0,q,S,4001.2000000029802,,,,,199292.40000000596,HRV,HRV_0122,2022-11-30 18:02:34
Great Britain,7,"Of the world's seven most populous islands, what's the only one not in Asia? ",76,0.976,22,199292.40000000596,p,K,3525.2999999970198,,,,,204317.70000000298,HRV,HRV_0122,2022-11-30 18:02:34
Martin Luther King Jr. ,3,Who won the Nobel Peace Prize in 1964? ,386,1.461,23,204317.79999999702,q,S,3624.7000000029802,,,,,209937.20000000298,HRV,HRV_0122,2022-11-30 18:02:34
George Marshall,4,What future secretary of state became America's first five-star general in December 1944? ,181,1.696,24,209937.20000000298,q,S,3327.5,,,,,215492.60000000894,HRV,HRV_0122,2022-11-30 18:02:34
Social Security,4,Ida May Fuller was the first U.S. citizen to receive a check for what?,46,1.232,25,215492.60000000894,t,W,5781.0,223791.0,227808.29999999702,1,1860.0,231413.79999999702,HRV,HRV_0122,2022-11-30 18:02:34
Kansas City ,2,The first suburban shopping center in the U.S. was established in what city?,99,1.547,26,231413.90000000596,q,S,3148.5999999940395,,,,,236627.90000000596,HRV,HRV_0122,2022-11-30 18:02:34
Tea leaves,5,Tasseomancy is a method of fortune telling that primarily uses what? ,418,1.6,27,236627.90000000596,q,S,2942.0,,,,,241688.10000000894,HRV,HRV_0122,2022-11-30 18:02:34
The sky,3,The Linke Scale is used to measure the blueness of what?,101,0.578,28,241688.20000000298,q,S,4526.5999999940395,,,,,247324.0,HRV,HRV_0122,2022-11-30 18:02:34
Monrovia,3,What African capital city is named after a U.S. president? ,128,1.967,29,247324.0,q,S,3702.0,,,,,253517.0,HRV,HRV_0122,2022-11-30 18:02:34
Louie Louie,2,What 1963 song led to a thirty-one month FBI investigation into supposed obscenities hidden in its unintelligible lyrics?,122,1.976,30,253517.10000000894,q,S,7358.0999999940395,,,,,263383.0,HRV,HRV_0122,2022-11-30 18:02:34
Apples. They don't have caffeine but the natural sugar and vitamins release slowly and make you feel more awake. ,2,Whice fruit is effective than coffee at waking you up in the morning?,454,0.712,31,263383.0,q,S,5005.100000008941,,,,,269627.0,HRV,HRV_0122,2022-11-30 18:02:34
OutKast,6,Who was sued in 1999 by Rosa Parks after they used her name to title a hit song?  ,379,0.936,32,269627.0,q,S,7433.20000000298,,,,,278517.60000000894,HRV,HRV_0122,2022-11-30 18:02:34
Mae West,6,"Because her name became a slang term for a life preserver, who is the only actress whose name is an entry in Merriam-Webster's?",26,0.569,33,278517.60000000894,q,S,5082.5999999940395,,,,,284691.10000000894,HRV,HRV_0122,2022-11-30 18:02:34
Apple sauce,6,What was the first food eaten in space?,435,1.521,34,284691.200000003,p,K,2908.4000000059605,,,,,289646.200000003,HRV,HRV_0122,2022-11-30 18:02:34
The Ritz (Hotel),4,"F. Scott Fitzgerald wrote a famous short story about ""A Diamond as Big as"" what New York landmark?",39,1.107,35,289646.299999997,p,K,5392.800000011921,,,,,296682.799999997,HRV,HRV_0122,2022-11-30 18:02:34
Brine Shrimp ,4,"What kind of animal is Artemia Salina, the ""sea monkey"" of novelty pet ad fame? ",222,1.38,36,296682.799999997,q,S,2445.0,,,,,301026.799999997,HRV,HRV_0122,2022-11-30 18:02:34
"Gaslight Café, Greenwich Village",2,Where did Bob Dylan first play in public? ,314,0.579,37,301026.799999997,q,S,1784.800000011921,,,,,303910.90000000596,HRV,HRV_0122,2022-11-30 18:02:34
Bono ,6,What singer took his stage name from a Dublin hearing aid billboard?  ,257,1.54,38,303910.90000000596,q,S,2117.5999999940395,,,,,308083.0,HRV,HRV_0122,2022-11-30 18:02:34
Camel,6,Which animal's milk does not curdle? ,328,1.149,39,308083.0,q,S,2230.0,,,,,311988.799999997,HRV,HRV_0122,2022-11-30 18:02:34
Dragees,2,"What are the sugared almonds, traditionally thrown over the bride and groom at a wedding, called?",430,1.15,40,311988.799999997,p,K,3221.9000000059605,,,,,316893.40000000596,HRV,HRV_0122,2022-11-30 18:02:34
Eisenhower ,2,Who was president when the first U.S. presidential news conference was filmed for TV?,378,1.818,41,316893.5,p,K,6642.600000008941,,,,,325874.700000003,HRV,HRV_0122,2022-11-30 18:02:34
Sapphire,2,What type of stone is referred to as the Star of India?  ,270,0.571,42,325874.799999997,q,S,3045.800000011921,,,,,330019.200000003,HRV,HRV_0122,2022-11-30 18:02:34
Nutmeg,2,What slightly hallucinogenic spice did Malcolm X use to get high while in prison? ,407,1.093,43,330019.200000003,q,S,3654.5,,,,,335294.5,HRV,HRV_0122,2022-11-30 18:02:34
It's stamped on the coin's edge.,4,"What is unusual about the ""in God We Trust"" Motto on the U.S. Mint's recent presidential dollar coins?",215,1.773,44,335294.5,q,S,5354.4000000059605,,,,,342961.299999997,HRV,HRV_0122,2022-11-30 18:02:34
George Washington,4,Who is pictured on a US Purple Heart medal? ,368,1.469,45,342961.299999997,q,S,2646.9000000059605,,,,,347617.799999997,HRV,HRV_0122,2022-11-30 18:02:34
"the Red Hot Chili Peppers, followed closely by Meatloaf",1,Some bands share a name with a food. Which band named after a foodstuff has sold the most records?,439,0.528,46,347617.799999997,q,S,4711.20000000298,,,,,353375.0,HRV,HRV_0122,2022-11-30 18:02:34
PayPal,4,YouTube.com is the brainchild of three former employees of what other major website? ,396,1.277,47,353375.0,q,S,3887.7000000029802,,,,,359079.0,HRV,HRV_0122,2022-11-30 18:02:34
Ripe cranerries bounce when dropped on the ground,3,How do farmers test whether cranberries are ripe?,452,1.646,48,359079.0,p,K,2841.2999999970198,,,,,364085.40000000596,HRV,HRV_0122,2022-11-30 18:02:34
Jim Lovell,5,Alan Shepard was scheduled to command the ill-fated Apollo 13 before switching missions with what astronaut?,18,1.77,49,364085.40000000596,q,S,6672.0,,,,,373059.10000000894,HRV,HRV_0122,2022-11-30 18:02:34
Texas,7,"What state's motto is ""friendship"" since that's supposed to have been the meaning of the state's Caddo Indian name?",263,0.57,50,373059.10000000894,q,S,4229.5999999940395,,,,,378371.0,HRV,HRV_0122,2022-11-30 18:02:34
Asparagus,4,what vegetable loses its flavour the quickest?,451,0.786,51,378371.0,q,S,2724.1000000089407,,,,,382398.90000000596,HRV,HRV_0122,2022-11-30 18:02:34
India,3,What's the only country outside Africa where lions still live in the wild?  ,307,1.545,52,382398.90000000596,q,S,5403.899999991059,,,,,389877.799999997,HRV,HRV_0122,2022-11-30 18:02:34
Spiro Agnew ,7,"What vice president referred to his critics as the ""nattering nabobs of negativism""? ",274,1.664,53,389877.799999997,q,S,3088.7000000029802,,,,,395141.0,HRV,HRV_0122,2022-11-30 18:02:34
Midnight Cowboy ,2,What was the only X-rated film to win the Academy Award for Best Picture?  ,293,0.806,54,395141.0,q,S,2289.7999999970198,,,,,398763.799999997,HRV,HRV_0122,2022-11-30 18:02:34
Liffey,4,What river runs through Dublin?   ,253,1.17,55,398763.799999997,q,S,2139.0,,,,,402600.299999997,HRV,HRV_0122,2022-11-30 18:02:34
Ronin,5,"What Japanese word for ""wave person"" refers to a masterless samurai?  ",219,1.301,56,402600.299999997,q,S,4781.100000008941,,,,,409208.5,HRV,HRV_0122,2022-11-30 18:02:34
Don Adams,4,Who provided the voice for cartoon character Inspector Gadget? ,372,1.02,57,409208.5,q,S,3338.5,,,,,414090.90000000596,HRV,HRV_0122,2022-11-30 18:02:34
cheese ,5,What item of food holds the world record for being the most stolen item of food in the world?,444,1.16,58,414091.0,q,S,4504.5,,,,,420281.90000000596,HRV,HRV_0122,2022-11-30 18:02:34
The Chrysler Building ,4,What skyscraper's exterior ornaments include radiator caps on the thirty-first floor and hood ornament eagles on the sixty-first floor?,258,1.428,59,420281.90000000596,q,S,4271.5999999940395,,,,,426497.5,HRV,HRV_0122,2022-11-30 18:02:34
Anne Hathaway,2,What was the name of William Shakespeare's wife?  ,290,1.8,60,426497.5,p,K,4299.600000008941,,,,,433133.40000000596,HRV,HRV_0122,2022-11-30 18:02:34
the skin and bones of animals,6,What is gelatin made from?,445,1.639,61,433133.40000000596,p,K,1620.7999999970198,,,,,436913.0,HRV,HRV_0122,2022-11-30 18:02:34
Belgium,7,Where were French fries invented?,437,1.269,62,436913.0,p,K,1908.7000000029802,,,,,440623.299999997,HRV,HRV_0122,2022-11-30 18:02:34
Abraham Lincoln,1,Who was the only U.S. president to also hold a patent for an invention?,384,0.993,63,440623.299999997,q,S,2424.800000011921,,,,,444576.90000000596,HRV,HRV_0122,2022-11-30 18:02:34
Library of Congress,1,"In 1802, John Beckley became the librarian of what collection containing 740 books at the time?",48,0.83,64,444576.90000000596,p,K,4013.7000000029802,,,,,449949.200000003,HRV,HRV_0122,2022-11-30 18:02:34
A Spoonful of Sugar ,7,What classic Disney song was inspired by lyricist Robert Sherman's fiver-year old son receiving the Sabin polio vaccine at school?,420,1.824,65,449949.200000003,q,S,4925.20000000298,,,,,457212.5,HRV,HRV_0122,2022-11-30 18:02:34
The nock,4,What slot on the back of an arrow's shaft keeps it on the bowstring? ,259,1.347,66,457212.5,q,S,3857.5,,,,,462952.90000000596,HRV,HRV_0122,2022-11-30 18:02:34
chickpeas,2,What is used to make hummus?,424,0.554,67,462952.90000000596,p,K,1866.2999999970198,,,,,465905.90000000596,HRV,HRV_0122,2022-11-30 18:02:34
Pride and Prejudice,3,"""An Assembly Such as This"" was a retelling of what famous literary work from a different character's point of view?",1,1.961,68,465905.90000000596,p,K,6509.0999999940395,,,,,474911.700000003,HRV,HRV_0122,2022-11-30 18:02:34
Snoopy's,2,"Whose doghouse apparently contains a basement, a pool table, an Andrew Wyeth painting, and a Jacuzzi?",387,0.855,69,474911.799999997,q,S,5618.800000011921,,,,,481919.40000000596,HRV,HRV_0122,2022-11-30 18:02:34
Arthur Conan Doyle,7,"What gullible author believed that Harry Houdini had ""wonderful powers"" after Houdini showed him the child's trick of pretending to remove his thumb? ",184,0.868,70,481919.5,q,S,2754.2000000029802,,,,,486079.0,HRV,HRV_0122,2022-11-30 18:02:34
Model train set,7,HO scale is the world's most popular size of what?,45,0.983,71,486079.0,q,S,2449.5,,,,,490037.200000003,HRV,HRV_0122,2022-11-30 18:02:34
Espresso,2,The Italian government regulates the price of what beverage?,399,0.87,72,490037.299999997,q,S,3370.1000000089407,,,,,494807.5,HRV,HRV_0122,2022-11-30 18:02:34
Mung beans ,1,What kind of bean produces the Asian-style bean sprouts in the produce section of supermarkets? ,404,1.732,73,494807.5,q,S,3005.2000000029802,,,,,500069.799999997,HRV,HRV_0122,2022-11-30 18:02:34
Kayak,3,An umiak is a larger version of what? ,20,0.636,74,500069.799999997,q,S,1618.9000000059605,,,,,502837.5,HRV,HRV_0122,2022-11-30 18:02:34
Every jar of peanut butter must be at least 90% peanuts,6,What percentage of peanuts is found in a standard jar of peanut butter?,423,1.671,75,502837.5,q,S,3752.1000000089407,,,,,508785.700000003,HRV,HRV_0122,2022-11-30 18:02:34
Death,7,"In ancient Egypt, what was the penalty for killing a cat?",58,1.997,76,508785.700000003,q,S,2425.0999999940395,,,,,513719.700000003,HRV,HRV_0122,2022-11-30 18:02:34
Germany,1,Which European country was the first to produce decaffeinated coffee? ,412,0.963,77,513719.700000003,q,S,2989.2999999970198,,,,,518195.200000003,HRV,HRV_0122,2022-11-30 18:02:34
Giant squid,2,What is the largest creature without a backbone? ,203,0.7,78,518195.200000003,q,S,1579.5999999940395,,,,,521009.10000000894,HRV,HRV_0122,2022-11-30 18:02:34
Kidnapping and killing the Lindbergh baby,1,For what crime was Bruno Hauptmann executed in 1936?,41,0.715,79,521009.10000000894,q,S,2151.0999999940395,,,,,524395.799999997,HRV,HRV_0122,2022-11-30 18:02:34
Gabriele Falloppio ,3,What Italian physician was the first to describe the way the ovaries connect to the uterus in humans?,217,0.946,80,524395.799999997,q,S,3417.9000000059605,,,,,529280.5,HRV,HRV_0122,2022-11-30 18:02:34
Gary Busey,3,What actor campaigned against helmet laws until he was almost killed in a helmetless 1988 motorcycle accident?,127,0.819,81,529280.5,q,S,4487.29999999702,,,,,535109.1000000089,HRV,HRV_0122,2022-11-30 18:02:34
On a Jell-O box,2,"Where would you see the consumer warning ""Do not use fresh or frozen pineapple, kiwi, ginger-root, papaya, figs, or guava""?",411,0.585,82,535109.200000003,q,S,5161.9000000059605,,,,,541392.299999997,HRV,HRV_0122,2022-11-30 18:02:34
Gecko,7,What is the only type of lizard that has a voice? ,213,1.703,83,541392.299999997,q,S,2072.1000000089407,,,,,545705.1000000089,HRV,HRV_0122,2022-11-30 18:02:34
Papillae,4,What are the bumps on the tongue that carry the taste buds called? ,137,0.622,84,545705.1000000089,p,K,4237.699999988079,,,,,551102.200000003,HRV,HRV_0122,2022-11-30 18:02:34
Utah,6,"What US state advertised ""The Greatest Snow on Earth"" on its license plates? ",273,1.48,85,551102.200000003,q,S,5086.0999999940395,,,,,558196.0,HRV,HRV_0122,2022-11-30 18:02:34
Brazil,6,"The United States has more stars on its flag than any other country, with fifty. What nation is in second place, with twenty-seven?",108,1.72,86,558196.0,q,S,5106.600000008941,,,,,565545.700000003,HRV,HRV_0122,2022-11-30 18:02:34
The Guinness Book of World Records,6,What did Ross and Norris McWhirter compile as a promotional giveaway in 1955? ,164,1.325,87,565545.799999997,q,S,3729.4000000059605,,,,,571118.900000006,HRV,HRV_0122,2022-11-30 18:02:34
Dragonflies,5,"Which insect, one of the fastest, can fly at speeds up to 60 mph? ",342,1.082,88,571118.900000006,q,S,2737.2999999970198,,,,,575459.1000000089,HRV,HRV_0122,2022-11-30 18:02:34
Odor Eaters ,6,What product did Herbert Lapidus invent in 1974 by impregnanting latex rubber with coconut charcoal?,248,1.122,89,575459.1000000089,q,S,3284.8999999910593,,,,,580392.299999997,HRV,HRV_0122,2022-11-30 18:02:34
Cayenne pepper ,1,What spice is named for the capital of French Guiana? ,409,0.655,90,580392.400000006,q,S,2056.8999999910593,,,,,583625.1000000089,HRV,HRV_0122,2022-11-30 18:02:34
Carbon,7,What element must be burned out of pig iron to make steel? ,170,0.555,91,583625.1000000089,q,S,3313.0999999940395,,,,,588018.900000006,HRV,HRV_0122,2022-11-30 18:02:34
Adding olive juice,5,What turns a plain martini into a dirty martini?,440,0.763,92,588019.1000000089,q,S,3556.7999999970198,,,,,592867.799999997,HRV,HRV_0122,2022-11-30 18:02:34
George H.W. Bush ,2,"Who said: ""I'm the president of the United States and I'm not going to eat any more broccoli""? ",415,1.692,93,592867.799999997,p,K,2946.1000000089407,,,,,598035.400000006,HRV,HRV_0122,2022-11-30 18:02:34
AstroTurf ,5,"What was originally sold in 1965 under the name ""Chemgrass""?  ",277,0.873,94,598035.400000006,q,S,3709.5,,,,,603147.6000000089,HRV,HRV_0122,2022-11-30 18:02:34
