QuestionNum,Question,Answer,exp,subjectId,date
1,Have you eaten anything since our last meal? ,a bit,HRV,HRV_0047,2022-11-30 18:53:50
2,How often do you work out?,2-3 times a week,HRV,HRV_0047,2022-11-30 18:53:50
3,How would you best describe your current diet?,Strict for non-weight related reasons,HRV,HRV_0047,2022-11-30 18:53:50
4,"We want to check that you are paying attention, please select ""Moderately"" as your answer.",Moderately,HRV,HRV_0047,2022-11-30 18:53:50
5,How tired do you feel?,Moderately,HRV,HRV_0047,2022-11-30 18:53:50
6,How strong is your desire to eat right now?,Moderately,HRV,HRV_0047,2022-11-30 18:53:50
7,How much do you think you could eat right now?,A light snack,HRV,HRV_0047,2022-11-30 18:53:50
