Answer,C_Pay,Question,QuestionNum,jitter,C_Trial,C_QPresent,rsp,C_SWK,C_SWK_rt,C_TrialEnd,C_AnswerPresent,C_WorthPresent,C_Worth,C_Worth_rt,trialEvents,exp,subjectId,date
USA,1,Which country invented volleyball?   ,340,1.083,0,2550.699999988079,q,S,1913.6000000238419,6070.699999988079,,,,,,HRV,HRV_0225,2022-11-30 18:51:30
Gerald Ford ,3,What president was shot while walking to California Governor Jerry Brown's office?  ,247,1.667,1,6070.800000011921,q,S,3241.699999988079,11502.599999964237,,,,,,HRV,HRV_0225,2022-11-30 18:51:30
Botany Bay,1,"What Pacific inlet was called ""Stingray Bay"" until Captain Cook renamed it for ""the great quantity of plants"" his scientists had discovered?",242,1.97,2,11502.699999988079,q,S,4122.100000023842,18117.899999976158,,,,,,HRV,HRV_0225,2022-11-30 18:51:30
Hong Kong ,1,What city's harbor is overlooked by Victoria Peak? ,185,1.379,3,18117.899999976158,q,S,2138.5,22161.30000001192,,,,,,HRV,HRV_0225,2022-11-30 18:51:30
Canada,4,What's the only country to have hosted a Summer Olympics in which it didn't win a single medal?   ,308,0.95,4,22161.30000001192,t,W,5664.799999952316,38722.80000001192,30344.5,34357.19999998808,4,2891.300000011921,,HRV,HRV_0225,2022-11-30 18:51:30
The Ritz (Hotel),1,"F. Scott Fitzgerald wrote a famous short story about ""A Diamond as Big as"" what New York landmark?",39,1.766,5,38723.0,q,S,3222.399999976158,44226.39999997616,,,,,,HRV,HRV_0225,2022-11-30 18:51:30
South Africa,5,In what country was the largest rough diamond ever discovered?,62,1.277,6,44226.5,q,S,2789.899999976158,48820.0,,,,,,HRV,HRV_0225,2022-11-30 18:51:30
Shaving,2,"The average male spends 2,965 hours doing what over the course of his lifetime?",92,0.967,7,48820.09999996424,q,S,4149.100000023842,54467.69999998808,,,,,,HRV,HRV_0225,2022-11-30 18:51:30
Fiber is the gut bacteria's preferred fuel source. ,3,What food is most beneficial for your gut bacteria?,458,1.251,8,54467.80000001192,q,S,4756.699999988079,60993.89999997616,,,,,,HRV,HRV_0225,2022-11-30 18:51:30
Captain Cook ,4,"Who christened Hawaii ""the Sandwich Islands"" in 1778?  ",363,1.227,9,60994.0,q,S,2679.199999988079,65419.69999998808,,,,,,HRV,HRV_0225,2022-11-30 18:51:30
Broccoli! ,5,Whice vegeteable has more vitamin C than an orange and as much calcium as whole milk?,456,1.405,10,65419.69999998808,q,S,3460.699999988079,70819.39999997616,,,,,,HRV,HRV_0225,2022-11-30 18:51:30
Sapphire,4,What type of stone is referred to as the Star of India?  ,270,1.207,11,70819.5,q,S,3173.300000011921,75727.0,,,,,,HRV,HRV_0225,2022-11-30 18:51:30
The Hardy Boys ,5,"Who solves crimes in Bayport, located on Barmet Bay? ",374,0.653,12,75727.09999996424,q,S,3169.400000035763,80080.59999996424,,,,,,HRV,HRV_0225,2022-11-30 18:51:30
Texas,6,"What state's motto is ""friendship"" since that's supposed to have been the meaning of the state's Caddo Indian name?",263,0.904,13,80080.59999996424,q,S,4104.800000011921,85617.5,,,,,,HRV,HRV_0225,2022-11-30 18:51:30
Air bags,6,"Sodium azide, a highly toxic chemical, is best-known for being used to develop what lifesaving devices?",84,1.939,14,85617.5,q,S,3599.399999976158,91676.09999996424,,,,,,HRV,HRV_0225,2022-11-30 18:51:30
Coca-Cola,2,"""Project Kansas"" was the name for the top secret 1985 attempt to revamp what product?",416,0.579,15,91676.19999998808,q,S,3748.699999988079,96545.30000001192,,,,,,HRV,HRV_0225,2022-11-30 18:51:30
Silver,7,What metal was found in Nevada's famed Comstock Lode?  ,230,1.424,16,96545.39999997616,q,S,3151.100000023842,101654.69999998808,,,,,,HRV,HRV_0225,2022-11-30 18:51:30
Montenegro,3,What European country is named for the dark-looking Dinaric Alps? ,173,1.489,17,101654.69999998808,q,S,3001.800000011921,106676.89999997616,,,,,,HRV,HRV_0225,2022-11-30 18:51:30
The Loch Ness Monster,1,"In 1994, Christian Spurling confessed that the so-called Surgeon's Photo of 1934 was a fake. What was pictured in it?",55,1.824,18,106676.89999997616,t,W,5172.199999988079,122943.59999996424,114377.19999998808,118394.0,3,2190.5,,HRV,HRV_0225,2022-11-30 18:51:30
Sudan,6,"Though an eleven-year ceasefire held from 1972 to 1983, what African country has been embroiled in a civil war since 1955?",115,1.205,19,122943.69999998808,q,S,4257.300000011921,128926.09999996424,,,,,,HRV,HRV_0225,2022-11-30 18:51:30
Silicon,5,What element is combined with oxygen to make up the mineral quartz?,269,1.928,20,128926.09999996424,q,S,2506.5,133882.39999997616,,,,,,HRV,HRV_0225,2022-11-30 18:51:30
Steamboat Geyser,2,"Which Yellowstone geyser, with eruptions 100 fee taller than Old Faithful's, is the world's tallest?",359,0.512,21,133882.39999997616,q,S,4006.600000023842,138921.89999997616,,,,,,HRV,HRV_0225,2022-11-30 18:51:30
Saffron,6,What is the most expensive spice (by weight) in the world?,431,1.353,22,138922.0,q,S,2790.599999964237,143589.89999997616,,,,,,HRV,HRV_0225,2022-11-30 18:51:30
The crocodile,1,The Egyptian plover is a bird best known for its symbiotic relationship with what host animal?,95,1.763,23,143589.89999997616,t,W,6170.800000011921,160067.30000001192,152290.09999996424,156304.69999998808,3,1480.1000000238419,,HRV,HRV_0225,2022-11-30 18:51:30
George VI,3,Who was the last British Monarch to also be an emperor?  ,381,0.746,24,160067.30000001192,q,S,1901.699999988079,163233.39999997616,,,,,,HRV,HRV_0225,2022-11-30 18:51:30
Ozone,5,"What molecule is named for the Greek word for ""smell,"" because of the odor associated with lightning storms?",232,1.508,25,163233.39999997616,q,S,3679.300000011921,168951.19999998808,,,,,,HRV,HRV_0225,2022-11-30 18:51:30
Matches,1,"Which accidentally invented household items were first marketed as ""friction lights""? ",322,0.88,26,168951.30000001192,q,S,4298.299999952316,174650.30000001192,,,,,,HRV,HRV_0225,2022-11-30 18:51:30
Espresso,2,The Italian government regulates the price of what beverage?,399,1.148,27,174650.30000001192,q,S,3126.5,179445.09999996424,,,,,,HRV,HRV_0225,2022-11-30 18:51:30
Apple sauce,1,What was the first food eaten in space?,435,0.9,28,179445.19999998808,t,W,3731.600000023842,193085.09999996424,185702.30000001192,189756.80000001192,4,1916.2999999523163,,HRV,HRV_0225,2022-11-30 18:51:30
Copperhead snake,5,Which poisonous snake smells like fresh cut cucumbers? ,350,1.683,29,193085.09999996424,q,S,2884.600000023842,198175.30000001192,,,,,"[{'event': 'onblur', 'details': 'out of focus', 'performance time': 193198.5, 'date time': 1669833882031}, {'event': 'onfocus', 'details': 'in focus', 'performance time': 194329.09999996424, 'date time': 1669833883162}]",HRV,HRV_0225,2022-11-30 18:51:30
Pepper and Mustard,2,What are the top two most popular spices in the world?,422,1.967,30,198175.30000001192,q,S,2698.099999964237,203360.19999998808,,,,,,HRV,HRV_0225,2022-11-30 18:51:30
honey,7,Which is the only food that can never go off or go bad?,442,1.507,31,203360.19999998808,q,S,3120.899999976158,208515.69999998808,,,,,,HRV,HRV_0225,2022-11-30 18:51:30
Peregrine falcon,6,"With its 240 mph hunting dive, what species of raptor is the fastest animal on earth?",60,0.658,32,208515.69999998808,q,S,3237.699999988079,212942.30000001192,,,,,,HRV,HRV_0225,2022-11-30 18:51:30
Joeys,6,What are infant marsupials called?  ,135,1.724,33,212942.30000001192,q,S,2458.5,217655.80000001192,,,,,,HRV,HRV_0225,2022-11-30 18:51:30
8 Mile Road ,1,"What road, which names a 2002 film, divides Wayne County from affluent Oakland and Maycomb Counties?",254,1.29,34,217655.80000001192,q,S,4122.099999964237,223587.39999997616,,,,,,HRV,HRV_0225,2022-11-30 18:51:30
Arkansas ,1,Where is the only active diamond mine in the U.S.?,320,1.299,35,223587.39999997616,q,S,3189.400000035763,228598.89999997616,,,,,,HRV,HRV_0225,2022-11-30 18:51:30
Cockroach,3,What animal can live up to a week without its head?,131,1.212,36,228599.0,q,S,3594.300000011921,233935.0,,,,,,HRV,HRV_0225,2022-11-30 18:51:30
Latex. This is known as the latex-fruit syndrome. ,6,Allergy to which material is associated with allergy to fruit such as papaya and banana? ,462,1.698,37,233935.0,q,S,4625.800000011921,240789.80000001192,,,,,,HRV,HRV_0225,2022-11-30 18:51:30
Peter Pan ,2,What was the first English play to be written especially for children? ,283,1.993,38,240789.89999997616,q,S,3051.900000035763,246347.5,,,,,,HRV,HRV_0225,2022-11-30 18:51:30
State quarters ,4,What's been released five times a year from January 1999 to fall 2008?,300,0.983,39,246347.5,q,S,3173.800000011921,251030.39999997616,,,,,,HRV,HRV_0225,2022-11-30 18:51:30
On a Jell-O box,5,"Where would you see the consumer warning ""Do not use fresh or frozen pineapple, kiwi, ginger-root, papaya, figs, or guava""?",411,0.831,40,251030.39999997616,q,S,4338.699999988079,256718.89999997616,,,,,,HRV,HRV_0225,2022-11-30 18:51:30
Criss-Cross ,7,What was the game of Scrabble originally called? ,286,1.787,41,256718.89999997616,q,S,3106.300000011921,262132.39999997616,,,,,,HRV,HRV_0225,2022-11-30 18:51:30
Andy Kaufman,6,Who was banned from Saturday Night Live by viewer phone vote in 1982? ,376,1.224,42,262132.5,q,S,3780.699999988079,267658.0,,,,,,HRV,HRV_0225,2022-11-30 18:51:30
coca-cola,1,Which famous soft drink was invented in 1892?,425,1.824,43,267658.0,t,W,4255.199999988079,282271.89999997616,274447.3000000119,278491.59999996424,2,1429.7000000476837,,HRV,HRV_0225,2022-11-30 18:51:30
Pen(n)sylvania ,2,What proper name is spelled unusually with a single 'n' both on the Liberty Bell and in the U.S. Constitution? ,249,0.638,44,282271.89999997616,q,S,4680.900000035763,288106.8000000119,,,,,,HRV,HRV_0225,2022-11-30 18:51:30
Ginseng ,2,"What plant takes its name for the Chinese words for ""man root""? ",245,1.29,45,288106.8000000119,q,S,4222.599999964237,294153.0,,,,,,HRV,HRV_0225,2022-11-30 18:51:30
Michael Dell,3,What founder of PCs Limited went on to become the youngest Fortune 500 CEO in history?,180,1.844,46,294153.0,q,S,2959.899999976158,299488.1999999881,,,,,,HRV,HRV_0225,2022-11-30 18:51:30
Museum of Modern Art in NYC ,4,"Which museum hung Matisse's ""Le Bateau"" upsidedown for more than a month, until an art student noticed the error?",348,0.601,47,299488.1999999881,q,S,3649.5,304254.39999997616,,,,,,HRV,HRV_0225,2022-11-30 18:51:30
Mung beans ,7,What kind of bean produces the Asian-style bean sprouts in the produce section of supermarkets? ,404,1.396,48,304254.39999997616,q,S,3154.699999988079,309327.39999997616,,,,,,HRV,HRV_0225,2022-11-30 18:51:30
Japan,1,Where is the longest suspension bridge? ,319,1.34,49,309327.39999997616,q,S,2633.5,313812.09999996424,,,,,,HRV,HRV_0225,2022-11-30 18:51:30
Shower curtain ,1,David Schmidt won the 2001 Ig Nobel Prize in Physics for discovering the horizontal vortex that makes what household item blow inward?,33,1.1,50,313812.09999996424,q,S,3949.2000000476837,319387.59999996424,,,,,,HRV,HRV_0225,2022-11-30 18:51:30
Tse-tse fly,5,What transmits the disease typanosomiasis to humans and cattle? ,267,1.523,51,319387.59999996424,q,S,4197.300000011921,325630.5,,,,,,HRV,HRV_0225,2022-11-30 18:51:30
Cheetah,5,Which is the only cat that cannot retract its claws? ,344,0.634,52,325630.59999996424,q,S,3490.800000011921,330279.5,,,,,,HRV,HRV_0225,2022-11-30 18:51:30
Australia,1,What country has six sheep for every human? ,158,1.249,53,330279.5,t,W,4105.699999988079,344034.1999999881,336912.5,340927.1999999881,3,1330.1000000238419,,HRV,HRV_0225,2022-11-30 18:51:30
Newborns ,7,The apgar score is used to measure the color and condition of what? ,91,1.119,54,344034.1999999881,q,S,2886.800000011921,348566.5,,,,,,HRV,HRV_0225,2022-11-30 18:51:30
Apples. They don't have caffeine but the natural sugar and vitamins release slowly and make you feel more awake. ,5,Whice fruit is effective than coffee at waking you up in the morning?,454,0.817,55,348566.5,q,S,3386.800000011921,353305.09999996424,,,,,,HRV,HRV_0225,2022-11-30 18:51:30
Poison-arrow frog,4,"Which animal's poison could kill up to 2,200 people? ",329,0.534,56,353305.1999999881,q,S,3584.199999988079,357960.3000000119,,,,,,HRV,HRV_0225,2022-11-30 18:51:30
American Pie,5,What was the name of the plane Buddy Holly died in?  ,289,1.561,57,357960.3000000119,q,S,2416.699999988079,362460.59999996424,,,,,,HRV,HRV_0225,2022-11-30 18:51:30
Rooster,1,What animal is combined with a serpent to make the mythical creature the Cockatrice? ,268,0.977,58,362460.59999996424,t,W,4876.600000023842,377512.3000000119,369869.09999996424,373879.5,4,2129.399999976158,,HRV,HRV_0225,2022-11-30 18:51:30
Chuck E. Cheese's,6,What restaurant chain was the brainchild of Atari founder Nolan Bushnell? ,251,0.646,59,377512.3000000119,q,S,3833.599999964237,382518.39999997616,,,,,,HRV,HRV_0225,2022-11-30 18:51:30
The Chesapeake Bay,4,What bay is actually the United States's largest tidal estuary? ,141,1.538,60,382518.39999997616,q,S,3010.900000035763,387578.39999997616,,,,,,HRV,HRV_0225,2022-11-30 18:51:30
A sneeze,6,The air expelled from what can travel at 100 mph?,90,1.716,61,387578.39999997616,q,S,2806.600000023842,392630.0,,,,,,HRV,HRV_0225,2022-11-30 18:51:30
"Puffer fish, if they are prepared incorrectly thheir poison could kill the eater. ",1,Cooking which food requires over two years of training?,461,1.298,62,392630.0,q,S,2803.399999976158,397262.39999997616,,,,,,HRV,HRV_0225,2022-11-30 18:51:30
Roulette,5,What game was created by French mathematician Blaise Pascal when he was experimenting with perpetual motion? ,182,1.944,63,397262.39999997616,q,S,3922.699999988079,403661.8000000119,,,,,,HRV,HRV_0225,2022-11-30 18:51:30
Germany,3,Which European country was the first to produce decaffeinated coffee? ,412,0.995,64,403661.8000000119,q,S,1996.0999999642372,407172.6999999881,,,,,,HRV,HRV_0225,2022-11-30 18:51:30
Spiro Agnew ,6,"What vice president referred to his critics as the ""nattering nabobs of negativism""? ",274,0.796,65,407172.8000000119,q,S,3220.7999999523163,411709.1999999881,,,,,,HRV,HRV_0225,2022-11-30 18:51:30
Bacon,4,"In Britain, what kind of meat comes in rashers?",397,1.489,66,411709.1999999881,q,S,3867.899999976158,417584.6999999881,,,,,,HRV,HRV_0225,2022-11-30 18:51:30
George H.W. Bush ,7,"Who said: ""I'm the president of the United States and I'm not going to eat any more broccoli""? ",415,0.991,67,417584.6999999881,q,S,3553.199999988079,422659.59999996424,,,,,,HRV,HRV_0225,2022-11-30 18:51:30
popscicle,1,What food was invented by an 11 year old in 1905?,450,1.559,68,422659.59999996424,t,W,3693.5,437046.1999999881,428876.89999997616,432899.59999996424,3,2054.5,,HRV,HRV_0225,2022-11-30 18:51:30
Camel,4,Which animal's milk does not curdle? ,328,1.519,69,437046.1999999881,q,S,1722.8999999761581,440803.3000000119,,,,,,HRV,HRV_0225,2022-11-30 18:51:30
Louisiana's,3,What U.S. state's civil law is most closely based on the Napoleonic Code?  ,272,1.269,70,440803.3000000119,q,S,2797.899999976158,445395.39999997616,,,,,,HRV,HRV_0225,2022-11-30 18:51:30
Sao Paulo,6,What's the most populous city in the Southern Hemisphere?,304,0.859,71,445395.39999997616,q,S,3062.100000023842,449846.6999999881,,,,,,HRV,HRV_0225,2022-11-30 18:51:30
Matches,5,John Walker invented what common household item having accidentally mixed potassium chlorate and antimony sulfide the previous year?,72,1.773,72,449846.8000000119,q,S,4266.299999952316,456421.59999996424,,,,,,HRV,HRV_0225,2022-11-30 18:51:30
The Mini Cooper,3,"With over 5.3 million sold since 1959, what's by far the most successful British car of all time?",394,1.628,73,456421.6999999881,q,S,3215.300000011921,461790.59999996424,,,,,,HRV,HRV_0225,2022-11-30 18:51:30
Pet Rocks,2,What imports from a Baja California beach made Gary Drahl a millionaire in late 1975?,186,1.017,74,461790.6999999881,q,S,3434.899999976158,466768.1999999881,,,,,,HRV,HRV_0225,2022-11-30 18:51:30
Coca-cola,6,What popular drink was first marketed as a brain tonic?,405,1.973,75,466768.3000000119,q,S,3322.899999976158,472598.39999997616,,,,,,HRV,HRV_0225,2022-11-30 18:51:30
UFOs,4,What was studied by Project Blue Book?   ,279,0.926,76,472598.5,q,S,2123.0,476200.5,,,,,,HRV,HRV_0225,2022-11-30 18:51:30
Peanuts ,3,What snack food is an ingredient in the explosive dynamite?  ,408,0.711,77,476200.5,q,S,3105.099999964237,480543.1999999881,,,,,,HRV,HRV_0225,2022-11-30 18:51:30
James Brown,2,"When asked to define ""cool,"" what two words did James Brown use? ",312,1.895,78,480543.3000000119,q,S,4243.799999952316,487194.89999997616,,,,,,HRV,HRV_0225,2022-11-30 18:51:30
Geyser,2,What English word comes from the name of a hot spring in Iceland's Haukadalur valley? ,171,1.293,79,487194.89999997616,q,S,4127.400000035763,493135.89999997616,,,,,,HRV,HRV_0225,2022-11-30 18:51:30
Shenandoah Valley,1,What area changed hands 72 times during the Civil War? ,139,1.464,80,493135.89999997616,q,S,3162.400000035763,498314.89999997616,,,,,,HRV,HRV_0225,2022-11-30 18:51:30
Thomas Crapper,5,What was the unfortunate name of the plumber who helped popularize and improve the flush toilet? ,294,1.326,81,498314.89999997616,q,S,4935.400000035763,505112.3000000119,,,,,,HRV,HRV_0225,2022-11-30 18:51:30
The Galapagos Islands ,3,What islands are home to most of the world's blue-footed boobies? ,216,1.053,82,505112.3000000119,q,S,3881.899999976158,510575.1999999881,,,,,,HRV,HRV_0225,2022-11-30 18:51:30
Rod Serling ,5,What famed TV personality wrote the screenplay for 1968's Planet of the Apes? ,175,0.98,83,510575.1999999881,q,S,3813.899999976158,515901.5,,,,,,HRV,HRV_0225,2022-11-30 18:51:30
Anaconda,3,Which species of snake gives birth to its young instead of laying eggs?  ,353,1.769,84,515901.59999996424,q,S,3892.5,522085.5,,,,,,HRV,HRV_0225,2022-11-30 18:51:30
Model train set,3,HO scale is the world's most popular size of what?,45,1.989,85,522085.5,q,S,3140.399999976158,527735.3999999762,,,,,,HRV,HRV_0225,2022-11-30 18:51:30
American Beauty,2,What Oscar-winning Best Picture is named for a type of rose? ,240,0.991,86,527735.3999999762,q,S,5043.0,534295.3999999762,,,,,,HRV,HRV_0225,2022-11-30 18:51:30
Sic semper tyrannis ,4,What state motto of Virginia did John Wilkes Booth shout as he jumped from Lincoln's box to the stage of Ford's Theatre? ,262,1.813,87,534295.3999999762,q,S,4795.100000023842,541428.3000000119,,,,,,HRV,HRV_0225,2022-11-30 18:51:30
Habanero,6,What chili pepper was believed the hottest in the world until the Naga Jolokia pepper was discovered in India in 2000?,401,1.019,88,541428.3999999762,q,S,4910.100000023842,547878.8000000119,,,,,,HRV,HRV_0225,2022-11-30 18:51:30
Capitol Hill,2,"Until 1790, what was known as Jenkins Hill? ",119,1.368,89,547878.8000000119,q,S,2623.7999999523163,552394.6999999881,,,,,,HRV,HRV_0225,2022-11-30 18:51:30
Hawaii,7,Where is the only royal palace in the United States? ,321,0.827,90,552394.6999999881,q,S,2735.100000023842,556480.5999999642,,,,,,HRV,HRV_0225,2022-11-30 18:51:30
The Stanley Cup ,2,Where is Jacques Plante's name misspelled five of the six times it appears? ,318,0.823,91,556480.5999999642,q,S,3610.800000011921,561465.3000000119,,,,,,HRV,HRV_0225,2022-11-30 18:51:30
There was a pound of every ingredient in the original reciipe. ,3,How did the pound cake get its name?,460,0.886,92,561465.3000000119,q,S,1801.2999999523163,564674.8999999762,,,,,,HRV,HRV_0225,2022-11-30 18:51:30
The Beatles' Rain ,6,What was the first rock song ever to feature hidden messages in the form of back-masked vocals?  ,284,0.565,93,564674.8999999762,q,S,3750.900000035763,569507.3999999762,,,,,,HRV,HRV_0225,2022-11-30 18:51:30
Ripe cranerries bounce when dropped on the ground,3,How do farmers test whether cranberries are ripe?,452,1.798,94,569507.3999999762,q,S,2598.800000011921,574434.5999999642,,,,,,HRV,HRV_0225,2022-11-30 18:51:30
Antawn Jamison ,5,What Washington Wizards All-Star still bears the misplaced w in his name from a birth certificate typo?,295,1.738,95,574434.5999999642,q,S,4151.300000011921,580842.5999999642,,,,,,HRV,HRV_0225,2022-11-30 18:51:30
"The code is ""SUX"" ",1,Why has Sioux Falls Regional Airport in South Dakota been trying to change its three-letter airport designation for years?,392,1.093,96,580842.5999999642,q,S,5072.100000023842,587523.8999999762,,,,,,HRV,HRV_0225,2022-11-30 18:51:30
Cement,1,"The SS Faith, a ship built by Leslie Comyn, was made of what unique material?",105,1.07,97,587524.0,t,W,4790.399999976158,602462.3999999762,594843.6999999881,598855.8000000119,4,2020.8999999761581,,HRV,HRV_0225,2022-11-30 18:51:30
