Answer,C_Pay,Question,QuestionNum,jitter,C_Trial,C_QPresent,rsp,C_SWK,C_SWK_rt,C_TrialEnd,trialEvents,exp,subjectId,date
at least 97%,4,How much caffeine needs to be taken out of coffee for it to be described as decaffeinated?,427,1.09,127,546911.0,q,S,1780.1000003814697,550290.5,,HRV,HRV_0205,2022-11-30 18:32:53
Mushrooms which have been exposed to light,2,What is the only non-animal natural source of vitamin D?,459,1.199,128,550290.5,q,S,1581.6000003814697,553579.3999996185,,HRV,HRV_0205,2022-11-30 18:32:53
The Mini Cooper,2,"With over 5.3 million sold since 1959, what's by far the most successful British car of all time?",394,1.15,129,553579.3999996185,q,S,2648.900001525879,557888.5,,HRV,HRV_0205,2022-11-30 18:32:53
Coca-Cola,4,"The BBC once banned the Beatles' ""Come Together"" for ""advertising"" what product in the lyrics?",93,1.07,130,557888.6000003815,q,S,1842.2999992370605,561310.2000007629,,HRV,HRV_0205,2022-11-30 18:32:53
Thomas Hardy,4,"Though the rest of him lies in Westminster Abbey, what writer's heart is buried near his native Dorchester?",116,1.36,131,561310.2000007629,q,S,1522.5,564703.6000003815,,HRV,HRV_0205,2022-11-30 18:32:53
Tea leaves,7,Tasseomancy is a method of fortune telling that primarily uses what? ,418,1.484,132,564703.7000007629,q,S,2385.2999992370605,569085.7000007629,,HRV,HRV_0205,2022-11-30 18:32:53
Untethered space walk,1,Challenger Astronaut Bruce McCandless II became Earth's first human to ever do what?,31,1.771,133,569085.7000007629,,,,578593.7000007629,,HRV,HRV_0205,2022-11-30 18:32:53
Peter Pan ,4,What was the first English play to be written especially for children? ,283,1.421,134,578593.8000011444,q,S,1844.6999988555908,582369.2000007629,,HRV,HRV_0205,2022-11-30 18:32:53
Texas,6,"What state's motto is ""friendship"" since that's supposed to have been the meaning of the state's Caddo Indian name?",263,1.333,135,582369.2000007629,q,S,2229.6000003814697,586444.3999996185,,HRV,HRV_0205,2022-11-30 18:32:53
The Guinness Book of World Records,7,What did Ross and Norris McWhirter compile as a promotional giveaway in 1955? ,164,1.115,136,586444.3999996185,q,S,2224.900001525879,590296.1000003815,,HRV,HRV_0205,2022-11-30 18:32:53
Brazil,1,"The United States has more stars on its flag than any other country, with fifty. What nation is in second place, with twenty-seven?",108,1.114,137,590296.1000003815,q,S,3366.8999996185303,595290.1000003815,,HRV,HRV_0205,2022-11-30 18:32:53
San Francisco Bay ,2,"What bay is Otis Redding serenading in ""(Sittin' on) the Dock of the Bay""? ",142,1.664,138,595290.1000003815,q,S,2924.2999992370605,600389.0,,HRV,HRV_0205,2022-11-30 18:32:53
