Answer,C_Pay,Question,QuestionNum,jitter,C_Trial,C_QPresent,rsp,C_SWK,C_SWK_rt,C_TrialEnd,trialEvents,exp,subjectId,date
Mung beans ,5,What kind of bean produces the Asian-style bean sprouts in the produce section of supermarkets? ,404,1.265,0,2349.0,p,K,4598.0,8726.39999961853,,HRV,HRV_0205,2022-11-30 18:32:53
Radioactivity,2,What is measured in becquerels? ,201,1.14,1,8726.39999961853,q,S,1689.3000011444092,12064.30000114441,,HRV,HRV_0205,2022-11-30 18:32:53
Graham Greene,2,"Which British novelist said, ""Fame is a powerful aphrodisiac""?",332,1.695,2,12064.30000114441,q,S,1968.5,16236.89999961853,,HRV,HRV_0205,2022-11-30 18:32:53
cooking,7,"If you suffer from Mageirocophobia, what are you scared of?",438,0.854,3,16236.89999961853,q,S,1974.6000003814697,19576.5,,HRV,HRV_0205,2022-11-30 18:32:53
George Marshall,2,What future secretary of state became America's first five-star general in December 1944? ,181,1.913,4,19576.5,q,S,2826.3999996185303,24823.80000114441,,HRV,HRV_0205,2022-11-30 18:32:53
Kansas City ,7,The first suburban shopping center in the U.S. was established in what city?,99,0.611,5,24823.89999961853,q,S,2233.6000003814697,28178.5,,HRV,HRV_0205,2022-11-30 18:32:53
Bacon,4,"In Britain, what kind of meat comes in rashers?",397,1.929,6,28178.5,q,S,2307.8999996185303,32926.20000076294,,HRV,HRV_0205,2022-11-30 18:32:53
Hong Kong ,5,What city's harbor is overlooked by Victoria Peak? ,185,1.714,7,32926.20000076294,q,S,1782.2999992370605,36931.20000076294,,HRV,HRV_0205,2022-11-30 18:32:53
Canada,3,What's the only country to have hosted a Summer Olympics in which it didn't win a single medal?   ,308,0.69,8,36931.20000076294,q,S,3166.2999992370605,41300.30000114441,,HRV,HRV_0205,2022-11-30 18:32:53
The popsicle,3,Which popular treat was invented by an 11-year-old in California? ,413,1.262,9,41300.39999961853,q,S,6221.0,49296.10000038147,,HRV,HRV_0205,2022-11-30 18:32:53
Zinfindel,3,"What grape, used to make a popular California wine, is called Primitivo in Europe?  ",403,0.888,10,49296.10000038147,q,S,2818.8999996185303,53514.80000114441,,HRV,HRV_0205,2022-11-30 18:32:53
Condoleeza (con dolcezza) Rice ,4,"Whose unusual first name is derived from an Italian musical term for ""with sweetness""? ",390,0.511,11,53514.89999961853,q,S,2698.1000003814697,57229.89999961853,,HRV,HRV_0205,2022-11-30 18:32:53
Ciabatta,7,"What sandwich bread, because of its shape, takes its name from the Italian for ""carpet slipper""? ",406,0.525,12,57229.89999961853,q,S,3415.5,61684.10000038147,,HRV,HRV_0205,2022-11-30 18:32:53
Midnight Cowboy ,6,What was the only X-rated film to win the Academy Award for Best Picture?  ,293,0.948,13,61684.20000076294,q,S,3115.7999992370605,66258.80000114441,,HRV,HRV_0205,2022-11-30 18:32:53
Speed of wind,5,What does an anemometer measure? ,168,1.206,14,66258.80000114441,p,K,3772.199998855591,71742.70000076294,,HRV,HRV_0205,2022-11-30 18:32:53
Molasses,6,"A two-million gallon tank of what substance exploded in Boston in 1919, resulting in 21 deaths?",10,1.749,15,71742.70000076294,q,S,1990.8999996185303,75993.89999961853,,HRV,HRV_0205,2022-11-30 18:32:53
Michael Dell,3,What founder of PCs Limited went on to become the youngest Fortune 500 CEO in history?,180,1.612,16,75993.89999961853,q,S,3849.400001525879,81966.60000038147,,HRV,HRV_0205,2022-11-30 18:32:53
Martin Luther King Jr. ,5,What civil rights leader did Dorothy Parker leave the bulk of her estate to?,149,1.349,17,81966.60000038147,q,S,2217.7000007629395,86042.60000038147,,HRV,HRV_0205,2022-11-30 18:32:53
St. Louis Gateway Arch ,7,"Which famous American landmark is officially called ""The Jefferson National Expansion Memorial""? ",341,1.911,18,86042.70000076294,q,S,2119.5,90583.89999961853,,HRV,HRV_0205,2022-11-30 18:32:53
Marven (Marvin) Gardens,7,"What Margate City, NJ, housing area has been misspelled on the Monopoly board for almost 80 years?",229,0.947,19,90583.89999961853,p,K,4241.0,96281.60000038147,,HRV,HRV_0205,2022-11-30 18:32:53
Cell,6,Robert Hooke coined what scientific term after looking at a piece of cork under a microscope?,81,0.91,20,96281.60000038147,q,S,2999.2999992370605,100698.89999961853,,HRV,HRV_0205,2022-11-30 18:32:53
Rod Serling ,3,What famed TV personality wrote the screenplay for 1968's Planet of the Apes? ,175,1.408,21,100699.0,q,S,2067.300001144409,104682.0,,HRV,HRV_0205,2022-11-30 18:32:53
Coca-Cola,4,"""Project Kansas"" was the name for the top secret 1985 attempt to revamp what product?",416,1.974,22,104682.0,q,S,3160.6000003814697,110325.70000076294,,HRV,HRV_0205,2022-11-30 18:32:53
Saffron,7,What is the most expensive spice (by weight) in the world?,431,1.054,23,110325.70000076294,q,S,3254.0,115147.80000114441,,HRV,HRV_0205,2022-11-30 18:32:53
Dorito is Spanish for little golden things,1,What does Dorito actually mean?,434,1.786,24,115147.89999961853,q,S,3129.6000003814697,120577.70000076294,,HRV,HRV_0205,2022-11-30 18:32:53
Happy Birthday,4,What was the first song ever performed in outer space? ,285,1.835,25,120577.70000076294,q,S,2260.6000003814697,125180.60000038147,,HRV,HRV_0205,2022-11-30 18:32:53
Steamboat Geyser,7,"Which Yellowstone geyser, with eruptions 100 fee taller than Old Faithful's, is the world's tallest?",359,1.92,26,125180.60000038147,q,S,3480.5,131090.8000011444,,HRV,HRV_0205,2022-11-30 18:32:53
Kayak,6,An umiak is a larger version of what? ,20,1.535,27,131090.8000011444,q,S,1592.3999996185303,134723.39999961853,,HRV,HRV_0205,2022-11-30 18:32:53
Belgium,4,Where were French fries invented?,437,0.603,28,134723.39999961853,q,S,1785.3000011444092,137623.8000011444,,HRV,HRV_0205,2022-11-30 18:32:53
Rabbit,1,What kind of animal attacked Jimmy Carter during an April 1979 fishing trip?   ,221,1.489,29,137623.8000011444,q,S,1926.5,141553.3000011444,,HRV,HRV_0205,2022-11-30 18:32:53
Australia,5,"""Welcome Stranger,"" the largest nugget of gold discovered, weighed 158 pounds and was discovered in what country?",5,1.156,30,141553.3000011444,q,S,3464.199998855591,146682.8000011444,,HRV,HRV_0205,2022-11-30 18:32:53
Orville Wright,5,Who was flying the plane in which the first US airplane fatality occurred? ,377,0.55,31,146682.8000011444,q,S,2878.699998855591,150621.89999961853,,HRV,HRV_0205,2022-11-30 18:32:53
Green Eggs and Ham,6,What 1960 classic originated when Bennett Cerf bet one of his authors that he couldn't write a book using only fifty words?,419,1.279,32,150621.89999961853,q,S,2554.800001144409,154960.0,,HRV,HRV_0205,2022-11-30 18:32:53
Carbon,2,What element must be burned out of pig iron to make steel? ,170,1.653,33,154960.0,q,S,2785.1000003814697,159911.70000076294,,HRV,HRV_0205,2022-11-30 18:32:53
Honey,3,"What food, still edible, was found by archaeologists in the tombs of Egyptian pharaohs? ",402,1.871,34,159911.70000076294,q,S,2456.2999992370605,164753.20000076294,,HRV,HRV_0205,2022-11-30 18:32:53
Papillae,7,What are the bumps on the tongue that carry the taste buds called? ,137,1.854,35,164753.39999961853,q,S,6009.0,173126.3000011444,,HRV,HRV_0205,2022-11-30 18:32:53
Columbus Circle ,4,What Manhattan intersection was America's first traffic circle?,228,1.058,36,173126.39999961853,q,S,1859.900001525879,176553.3000011444,,HRV,HRV_0205,2022-11-30 18:32:53
"the Red Hot Chili Peppers, followed closely by Meatloaf",2,Some bands share a name with a food. Which band named after a foodstuff has sold the most records?,439,0.596,37,176553.39999961853,q,S,2674.7000007629395,180333.10000038147,,HRV,HRV_0205,2022-11-30 18:32:53
Poison-arrow frog,6,"Which animal's poison could kill up to 2,200 people? ",329,0.57,38,180333.10000038147,q,S,2036.5,183444.10000038147,,HRV,HRV_0205,2022-11-30 18:32:53
Sugar-sweetened beverages are likely the most fattening becaause they are not registered as consumed calories. ,6,What is the most fattening product in the modern diet?,457,1.43,39,183444.10000038147,q,S,1551.5,186936.0,,HRV,HRV_0205,2022-11-30 18:32:53
Gary Busey,6,What actor campaigned against helmet laws until he was almost killed in a helmetless 1988 motorcycle accident?,127,1.107,40,186936.0,q,S,2242.800001144409,190792.3000011444,,HRV,HRV_0205,2022-11-30 18:32:53
Museum of Modern Art in NYC ,3,"Which museum hung Matisse's ""Le Bateau"" upsidedown for more than a month, until an art student noticed the error?",348,0.593,41,190792.3000011444,q,S,5653.299999237061,197553.5,,HRV,HRV_0205,2022-11-30 18:32:53
Tim McGraw,5,"At age 11, who accidentally discovered the true identity of his baseball pitcher father while searching his mother's closet for hidden Christmas presents? ",24,1.093,42,197553.5,q,S,4158.89999961853,203314.70000076294,,HRV,HRV_0205,2022-11-30 18:32:53
Teeth,3,"One in every 2,000 babies is born with what? ",77,1.302,43,203314.8000011444,q,S,1921.1999988555908,207050.5,,HRV,HRV_0205,2022-11-30 18:32:53
The Discovery,3,Which space shuttle is named for the ship on which Robert Scott first sailed to Antarctica? ,352,1.58,44,207050.5,q,S,2204.8999996185303,211341.60000038147,,HRV,HRV_0205,2022-11-30 18:32:53
The World Almanac and Book of Facts,6,What reference classic is still named for the defunct New York newspaper that first published it in 1868?,250,1.886,45,211341.60000038147,q,S,3724.7999992370605,217460.10000038147,,HRV,HRV_0205,2022-11-30 18:32:53
Canadian Oil,4,What is canola an abbreviation for?,436,1.054,46,217460.10000038147,q,S,2754.7000007629395,221780.3000011444,,HRV,HRV_0205,2022-11-30 18:32:53
On Christ's crucifix ,6,"Where did the abbreviation ""INRI"" traditionally appear? ",315,1.893,47,221780.3000011444,q,S,1703.099998474121,225882.3000011444,,HRV,HRV_0205,2022-11-30 18:32:53
"A peanut is a legume, not a nut",7,What type of food is a peanut?,447,1.663,48,225882.3000011444,p,K,2295.199998855591,230349.3000011444,,HRV,HRV_0205,2022-11-30 18:32:53
Ivory Coast's ,2,"The world's largest church is Our Lady of Peace Basilica in Yamoussoukro, what nation's capital?",111,0.598,49,230349.3000011444,q,S,1587.0,233044.20000076294,,HRV,HRV_0205,2022-11-30 18:32:53
Social Security,7,Ida May Fuller was the first U.S. citizen to receive a check for what?,46,1.418,50,233044.20000076294,q,S,2625.6000003814697,237595.10000038147,,HRV,HRV_0205,2022-11-30 18:32:53
Rafflesia (corpse lily) ,2,What is the largest flower in the world? ,204,1.475,51,237595.10000038147,q,S,2442.2000007629395,242019.60000038147,,HRV,HRV_0205,2022-11-30 18:32:53
Queen Isabella I ,3,"In 1893, who became the first woman ever to appear on a U.S. postage stamp?",50,1.717,52,242019.60000038147,q,S,2275.7000007629395,246521.60000038147,,HRV,HRV_0205,2022-11-30 18:32:53
Silicon,7,What element is combined with oxygen to make up the mineral quartz?,269,0.715,53,246521.70000076294,q,S,1550.8999996185303,249297.5,,HRV,HRV_0205,2022-11-30 18:32:53
An otter,5,What animal lives in a holt? ,133,0.588,54,249297.60000038147,q,S,1758.7999992370605,252157.3000011444,,HRV,HRV_0205,2022-11-30 18:32:53
Avocados have twice the amount of potassium as bananas. ,2,Which fruit has more potassium than bananas?,455,1.906,55,252157.3000011444,q,S,1652.599998474121,256225.8000011444,,HRV,HRV_0205,2022-11-30 18:32:53
Habanero,6,What chili pepper was believed the hottest in the world until the Naga Jolokia pepper was discovered in India in 2000?,401,1.097,56,256225.89999961853,q,S,2585.6000003814697,260421.0,,HRV,HRV_0205,2022-11-30 18:32:53
The Korean War,3,"What 20th-century conflict was dubbed the ""forgotten war"" despite over 50,000 U.S. deaths?",126,1.848,57,260421.0,q,S,2012.1000003814697,264791.5,,HRV,HRV_0205,2022-11-30 18:32:53
Delaware,2,"Excepting Alaska and Louisiana, what US state is divided into the fewest counties, with only three?",38,0.813,58,264791.60000038147,q,S,1916.3999996185303,268025.20000076294,,HRV,HRV_0205,2022-11-30 18:32:53
Chitty Chitty Bang Bang ,2,What was the only children's story ever published by James Bond creator Ian Fleming? ,292,1.193,59,268025.3000011444,q,S,2648.0,272380.20000076294,,HRV,HRV_0205,2022-11-30 18:32:53
Ear ,1,"The pinna is the outer, visible part of what?",103,1.434,60,272380.20000076294,q,S,1827.6999988555908,276155.10000038147,,HRV,HRV_0205,2022-11-30 18:32:53
The Missouri River ,2,"What forms the only part of the Kansas border, a seventy-five mile stretch, that's not drawn with a straight edge?",179,0.928,61,276155.10000038147,q,S,3437.1000003814697,281030.89999961853,,HRV,HRV_0205,2022-11-30 18:32:53
spiced ham,4,What two words were combined to make the word Spam?,426,1.533,62,281030.89999961853,q,S,3785.7000007629395,286862.8000011444,,HRV,HRV_0205,2022-11-30 18:32:53
Ginseng ,1,"What plant takes its name for the Chinese words for ""man root""? ",245,1.272,63,286862.8000011444,p,K,3527.699998855591,292175.0,,HRV,HRV_0205,2022-11-30 18:32:53
Fiber is the gut bacteria's preferred fuel source. ,4,What food is most beneficial for your gut bacteria?,458,1.933,64,292175.0,p,K,3403.800001144409,298023.5,,HRV,HRV_0205,2022-11-30 18:32:53
Anaconda,6,Which species of snake gives birth to its young instead of laying eggs?  ,353,1.652,65,298023.5,q,S,3493.800001144409,303678.3000011444,,HRV,HRV_0205,2022-11-30 18:32:53
Strom Thurmond ,7,Who filibustered for a record twenty-four hours and eighteen minutes -- with a urine pail standing at the ready -- in the hope of preventing the Civil Rights Act of 1957?,366,1.532,66,303678.3000011444,q,S,3172.099998474121,308896.8000011444,,HRV,HRV_0205,2022-11-30 18:32:53
China,5,Which country first used the decimal system?  ,338,1.02,67,308896.89999961853,q,S,1827.7000007629395,312255.0,,HRV,HRV_0205,2022-11-30 18:32:53
Nuclear Disarmament,6,"The famous ""peace symbol"" was designed to combine the semaphoe positions for N and D. What do the N and D stand for?",97,1.674,68,312255.0,q,S,2805.0,317244.5,,HRV,HRV_0205,2022-11-30 18:32:53
Sic semper tyrannis ,3,What state motto of Virginia did John Wilkes Booth shout as he jumped from Lincoln's box to the stage of Ford's Theatre? ,262,1.851,69,317244.5,q,S,2277.800001144409,321885.89999961853,,HRV,HRV_0205,2022-11-30 18:32:53
Spiro Agnew ,1,"What vice president referred to his critics as the ""nattering nabobs of negativism""? ",274,1.948,70,321885.89999961853,q,S,1928.900001525879,326276.3000011444,,HRV,HRV_0205,2022-11-30 18:32:53
Rechargeable batteries,5,"Three quarters of the cadmium mined annually is used, with nickel, to make what household items?",117,0.751,71,326276.3000011444,q,S,2038.7999992370605,329573.39999961853,,HRV,HRV_0205,2022-11-30 18:32:53
University of Phoenix,5,"What school has the most students over age 25, according to U.S. News & World Report?",256,0.841,72,329573.39999961853,q,S,2052.6000003814697,332975.89999961853,,HRV,HRV_0205,2022-11-30 18:32:53
The Atlas,7,"The U.S.'s first successful ICBM was what rocket named for a Titan of Greek myth, later used to launch John Glenn into orbit?",107,1.563,73,332975.89999961853,q,S,3004.5,338052.20000076294,,HRV,HRV_0205,2022-11-30 18:32:53
South America,5,The electric eel is native only to what continent?,96,1.295,74,338052.20000076294,q,S,1742.7999992370605,341602.89999961853,,HRV,HRV_0205,2022-11-30 18:32:53
Paris,3,"What city is home to the world's very first pet cemetery, in which Rin Tin Tin is buried?",148,1.003,75,341603.0,q,S,2619.5,345738.3000011444,,HRV,HRV_0205,2022-11-30 18:32:53
Japan,2,Where is the longest suspension bridge? ,319,1.851,76,345738.3000011444,q,S,1698.6999988555908,349797.10000038147,,HRV,HRV_0205,2022-11-30 18:32:53
The U.S. Air Force,3,What current branch of the U.S. military was a corps of only 50 soldiers when World War I broke out?,161,0.743,77,349797.20000076294,q,S,2085.5,353138.10000038147,,HRV,HRV_0205,2022-11-30 18:32:53
George H.W. Bush ,5,"Who said: ""I'm the president of the United States and I'm not going to eat any more broccoli""? ",415,1.802,78,353138.10000038147,q,S,2731.7999992370605,358183.5,,HRV,HRV_0205,2022-11-30 18:32:53
Montenegro,4,What European country is named for the dark-looking Dinaric Alps? ,173,1.403,79,358183.5,q,S,1906.8000011444092,362004.10000038147,,HRV,HRV_0205,2022-11-30 18:32:53
OutKast,4,Who was sued in 1999 by Rosa Parks after they used her name to title a hit song?  ,379,1.491,80,362004.10000038147,q,S,2260.7000007629395,366268.8000011444,,HRV,HRV_0205,2022-11-30 18:32:53
KISS ,5,"According to the Guinness Book of Records, what was the loudest rock band ever?",13,1.476,81,366268.8000011444,q,S,2033.7999992370605,370292.3000011444,,HRV,HRV_0205,2022-11-30 18:32:53
The Big Bang,1,"Arno Penzias and Robert Wilson shared a Nobel Prize for accidentally discovering ""CMB,"" leftover radiation from what?",22,1.5,82,370292.39999961853,q,S,1894.900001525879,374195.89999961853,,HRV,HRV_0205,2022-11-30 18:32:53
Thomas Crapper,1,What was the unfortunate name of the plumber who helped popularize and improve the flush toilet? ,294,1.795,83,374195.89999961853,q,S,1940.7000007629395,378440.60000038147,,HRV,HRV_0205,2022-11-30 18:32:53
Liberia,1,"Before his ears were cut off in 1990 by a political rival, what nation was ruled by dictator Samuel Doe?",27,1.105,84,378440.60000038147,q,S,1603.3999996185303,381661.3000011444,,HRV,HRV_0205,2022-11-30 18:32:53
Smoke,4,"in 1908, New York City passed the Sullivan Ordinance which made it illegal for women to do what in public?",52,1.902,85,381661.39999961853,q,S,1902.2000007629395,385972.8000011444,,HRV,HRV_0205,2022-11-30 18:32:53
Pepper and Mustard,7,What are the top two most popular spices in the world?,422,1.727,86,385972.8000011444,q,S,1749.0,389961.60000038147,,HRV,HRV_0205,2022-11-30 18:32:53
Eric the Red,5,"According to Norse sagas, who gave Greenland its misleading name in order to attract settlers? ",12,1.61,87,389961.60000038147,q,S,1576.7999992370605,393660.39999961853,,HRV,HRV_0205,2022-11-30 18:32:53
Pearl Harbor ,3,What late-breaking news story kicked Dumbo off the cover of Time magazine six weeks after the elephant cartoon's release?,227,1.203,88,393660.39999961853,q,S,1966.8000011444092,397343.10000038147,,HRV,HRV_0205,2022-11-30 18:32:53
Matches,2,John Walker invented what common household item having accidentally mixed potassium chlorate and antimony sulfide the previous year?,72,1.562,89,397343.20000076294,q,S,2386.0,401797.39999961853,,HRV,HRV_0205,2022-11-30 18:32:53
@,1,"in 2004, for the Internet age, what new character was added to the Morse code alphabet, the first ever official addition since world war I?",56,1.843,90,401797.39999961853,q,S,1874.8000011444092,406027.3000011444,,HRV,HRV_0205,2022-11-30 18:32:53
Aluminum,6,Bauxite ore is mined so it can be processed into what metal?,25,1.322,91,406027.3000011444,q,S,2421.5,410281.70000076294,,HRV,HRV_0205,2022-11-30 18:32:53
Texas,3,"In what state was the U.S.'s first ""Adopt-a-Highway"" program started?",67,1.488,92,410281.8000011444,q,S,1978.8999996185303,414261.10000038147,,HRV,HRV_0205,2022-11-30 18:32:53
Hawaii,7,Where is the only royal palace in the United States? ,321,1.42,93,414261.10000038147,q,S,1873.5,418069.39999961853,,HRV,HRV_0205,2022-11-30 18:32:53
lobster,4,Which expensive restaurant item used to be fed to pisinors and servants?,449,1.584,94,418069.39999961853,q,S,1966.0,422131.10000038147,,HRV,HRV_0205,2022-11-30 18:32:53
What do women want? ,1,"What was the one question Sigmund Freud said he was unable to answer, despite 30 years of research?",291,1.208,95,422131.10000038147,q,S,2259.8999996185303,426112.60000038147,,HRV,HRV_0205,2022-11-30 18:32:53
Cayenne pepper ,2,What spice is named for the capital of French Guiana? ,409,0.59,96,426112.60000038147,q,S,1667.2000007629395,428876.89999961853,,HRV,HRV_0205,2022-11-30 18:32:53
The bishop,3,Which chess piece was originally called 'the elephant'? ,334,1.828,97,428876.89999961853,q,S,1663.900001525879,432881.5,,HRV,HRV_0205,2022-11-30 18:32:53
Espresso,3,The Italian government regulates the price of what beverage?,399,0.998,98,432881.5,q,S,5824.0,440217.20000076294,"[{'event': 'visibilitychange', 'details': 'hidden', 'performance time': 434780.89999961853, 'date time': 1669833007733}, {'event': 'onblur', 'details': 'out of focus', 'performance time': 434957.39999961853, 'date time': 1669833007909}, {'event': 'visibilitychange', 'details': 'visible', 'performance time': 436997, 'date time': 1669833009949}, {'event': 'onfocus', 'details': 'in focus', 'performance time': 437592.70000076294, 'date time': 1669833010544}]",HRV,HRV_0205,2022-11-30 18:32:53
State quarters ,4,What's been released five times a year from January 1999 to fall 2008?,300,0.751,99,440217.3000011444,q,S,2400.099998474121,443876.39999961853,,HRV,HRV_0205,2022-11-30 18:32:53
Mice,3,"After humans, what's the worlds most abundant mammal species?",16,1.696,100,443876.5,q,S,1994.7000007629395,448078.70000076294,,HRV,HRV_0205,2022-11-30 18:32:53
Lava lamp ,1,What was first made by suspending paraffin in a solution of water and antifreeze? ,276,1.651,101,448078.70000076294,q,S,1848.5,452085.3000011444,,HRV,HRV_0205,2022-11-30 18:32:53
Geyser,2,What English word comes from the name of a hot spring in Iceland's Haukadalur valley? ,171,1.926,102,452085.3000011444,q,S,1820.099998474121,456335.20000076294,,HRV,HRV_0205,2022-11-30 18:32:53
Ripe cranerries bounce when dropped on the ground,2,How do farmers test whether cranberries are ripe?,452,1.892,103,456335.20000076294,q,S,2080.2999992370605,460818.70000076294,,HRV,HRV_0205,2022-11-30 18:32:53
George VI,4,Who was the last British Monarch to also be an emperor?  ,381,1.474,104,460818.8000011444,q,S,1891.3999996185303,464692.20000076294,,HRV,HRV_0205,2022-11-30 18:32:53
AstroTurf ,7,"What was originally sold in 1965 under the name ""Chemgrass""?  ",277,0.536,105,464692.20000076294,q,S,1582.8999996185303,467323.89999961853,,HRV,HRV_0205,2022-11-30 18:32:53
Australia,6,What country has six sheep for every human? ,158,0.994,106,467323.89999961853,q,S,2147.0,470976.39999961853,,HRV,HRV_0205,2022-11-30 18:32:53
Capitol Hill,7,"Until 1790, what was known as Jenkins Hill? ",119,1.948,107,470976.5,q,S,2164.1000003814697,475603.3000011444,,HRV,HRV_0205,2022-11-30 18:32:53
Bile,5,"Two of the ""four humors"" the ancients believed controlled temperament consist of what bodily fluid?",118,1.411,108,475603.39999961853,q,S,2750.800001144409,480276.70000076294,,HRV,HRV_0205,2022-11-30 18:32:53
Jim Lovell,3,Alan Shepard was scheduled to command the ill-fated Apollo 13 before switching missions with what astronaut?,18,1.623,109,480276.70000076294,q,S,2096.5,484502.20000076294,,HRV,HRV_0205,2022-11-30 18:32:53
Every jar of peanut butter must be at least 90% peanuts,7,What percentage of peanuts is found in a standard jar of peanut butter?,423,0.501,110,484502.20000076294,q,S,1720.6000003814697,487238.10000038147,,HRV,HRV_0205,2022-11-30 18:32:53
Excalibur,3,"According to Thomas Malory, Sir Bedivere's last knightly act is to return what to a lake?",14,0.675,111,487238.10000038147,q,S,2011.2999992370605,490431.39999961853,,HRV,HRV_0205,2022-11-30 18:32:53
School buses were painted yellow,5,A conference on safety held at Columbia University's Teacher College in 1939 led to what change? ,9,0.862,112,490431.5,q,S,1596.6000003814697,493415.3000011444,,HRV,HRV_0205,2022-11-30 18:32:53
popscicle,3,What food was invented by an 11 year old in 1905?,450,1.314,113,493415.3000011444,q,S,1807.8999996185303,497046.8000011444,,HRV,HRV_0205,2022-11-30 18:32:53
Charles Babbage ,4,"What inventor of the Difference Engine once baked himself in an oven for five minutes, ""to see what would happen""?",192,1.584,114,497046.8000011444,q,S,2779.7999992370605,501920.10000038147,,HRV,HRV_0205,2022-11-30 18:32:53
Antawn Jamison ,7,What Washington Wizards All-Star still bears the misplaced w in his name from a birth certificate typo?,295,1.663,115,501920.10000038147,q,S,3373.2999992370605,507466.60000038147,,HRV,HRV_0205,2022-11-30 18:32:53
Twenty-fourth ,6,Which Constitutional Amendment deals with poll taxes? ,335,1.089,116,507466.70000076294,q,S,1828.6000003814697,510896.89999961853,,HRV,HRV_0205,2022-11-30 18:32:53
The barrel of a gun,4,"According to Chairman Mao, ""political power grows out of"" what?",11,1.658,117,510897.0,q,S,1549.5,514617.89999961853,,HRV,HRV_0205,2022-11-30 18:32:53
Juvenile deliquent,6,What did popular author J.D. Salinger reveal the first two intials in his name to stand for?  ,163,1.438,118,514617.89999961853,q,S,1912.1000003814697,518476.60000038147,,HRV,HRV_0205,2022-11-30 18:32:53
Smurfette,7,"Who did Gargamel create using ingredients like crocodile tears, the tip of an adder's tongue and a hard stone for a heart?",364,1.19,119,518476.60000038147,q,S,3623.2000007629395,523798.20000076294,,HRV,HRV_0205,2022-11-30 18:32:53
Pressure,3,What is measured in millibars? ,202,0.661,120,523798.20000076294,q,S,1791.0,526757.1000003815,,HRV,HRV_0205,2022-11-30 18:32:53
On a Jell-O box,2,"Where would you see the consumer warning ""Do not use fresh or frozen pineapple, kiwi, ginger-root, papaya, figs, or guava""?",411,0.881,121,526757.1000003815,q,S,2461.2999992370605,530611.6000003815,,HRV,HRV_0205,2022-11-30 18:32:53
"Gaslight CafÃ©, Greenwich Village",1,Where did Bob Dylan first play in public? ,314,0.875,122,530611.6000003815,q,S,1732.7000007629395,533727.8999996185,,HRV,HRV_0205,2022-11-30 18:32:53
There was a pound of every ingredient in the original reciipe. ,2,How did the pound cake get its name?,460,0.94,123,533727.8999996185,q,S,1504.3000011444092,536684.3999996185,,HRV,HRV_0205,2022-11-30 18:32:53
coca-cola,7,Which famous soft drink was invented in 1892?,425,0.741,124,536684.3999996185,q,S,1722.7000007629395,539655.2000007629,,HRV,HRV_0205,2022-11-30 18:32:53
A glacial ridge,3,What is an esker? ,198,1.372,125,539655.2000007629,q,S,1547.7999992370605,543081.7000007629,,HRV,HRV_0205,2022-11-30 18:32:53
Don Adams,1,Who provided the voice for cartoon character Inspector Gadget? ,372,1.356,126,543081.7000007629,q,S,1960.7999992370605,546911.0,,HRV,HRV_0205,2022-11-30 18:32:53
