Answer,C_Pay,Question,QuestionNum,jitter,C_Trial,C_QPresent,rsp,C_SWK,C_SWK_rt,C_AnswerPresent,C_WorthPresent,C_Worth,C_Worth_rt,C_TrialEnd,trialEvents,exp,subjectId,date
Thomas Nast ,4,Which cartoonist is famous for creating the popular image of Santa Claus? ,333,1.344,0,2856.399999856949,t,W,4725.5,10111.200000047684,14138.700000047684,5,2312.199999809265,18320.5,,HRV,HRV_0085,2022-11-30 17:41:01
The I Ching,2,"Pink Floyd's ""Chapter 24"" was inspired by what literary work?",80,1.519,1,18320.700000047684,p,K,3944.7999999523163,,,,,24309.89999985695,,HRV,HRV_0085,2022-11-30 17:41:01
Sepia,4,What tinting process for black and white photography was named for the genus of cuttlefish that originally provided the pigment?,266,1.846,2,24310.5,t,W,5821.099999904633,32664.89999985695,36682.0,5,1388.2999999523163,40431.799999952316,,HRV,HRV_0085,2022-11-30 17:41:01
Haddock,1,"If you ordered an Omelet Arnold Bennett, what fish would you find in it?",429,1.249,3,40431.89999985695,p,K,5605.100000143051,,,,,47812.700000047684,,HRV,HRV_0085,2022-11-30 17:41:01
The World Almanac and Book of Facts,7,What reference classic is still named for the defunct New York newspaper that first published it in 1868?,250,0.949,4,47813.299999952316,p,K,7323.700000047684,,,,,56628.39999985695,,HRV,HRV_0085,2022-11-30 17:41:01
Cayenne pepper ,2,What spice is named for the capital of French Guiana? ,409,0.721,5,56628.5,p,K,5688.599999904633,,,,,63550.299999952316,,HRV,HRV_0085,2022-11-30 17:41:01
"the white flesh that houses the seeds, known as the placenta",3,What is the hottest part of a chili?,432,1.949,6,63551.0,p,K,2623.5,,,,,68656.29999995232,,HRV,HRV_0085,2022-11-30 17:41:01
Westminster Kennel Club dog show ,3,What is the second oldest continuously held American sporting event?  ,214,1.817,7,68656.70000004768,p,K,4011.899999856949,,,,,75013.79999995232,,HRV,HRV_0085,2022-11-30 17:41:01
The popsicle,7,Which popular treat was invented by an 11-year-old in California? ,413,0.793,8,75014.5,t,W,3536.5,81077.0,85102.70000004768,5,2274.5999999046326,88685.0,,HRV,HRV_0085,2022-11-30 17:41:01
Dragonflies,7,"Which insect, one of the fastest, can fly at speeds up to 60 mph? ",342,1.549,9,88685.59999990463,p,K,3991.9000000953674,,,,,94753.89999985695,,HRV,HRV_0085,2022-11-30 17:41:01
Jamaica Bay,4,"What lagoon south of Queens, New York, is named for a local Indian tribe and has nothing to do Caribbean?",226,1.873,10,94754.0,p,K,7934.0,,,,,105100.79999995232,,HRV,HRV_0085,2022-11-30 17:41:01
Avocados have twice the amount of potassium as bananas. ,4,Which fruit has more potassium than bananas?,455,0.522,11,105101.39999985695,q,S,5386.0,,,,,111540.89999985695,"[{'event': 'onblur', 'details': 'out of focus', 'performance time': 108775.5, 'date time': 1669829561839}]",HRV,HRV_0085,2022-11-30 17:41:01
Chitty Chitty Bang Bang ,1,What was the only children's story ever published by James Bond creator Ian Fleming? ,292,1.879,12,111541.39999985695,t,W,5526.100000143051,119594.89999985695,123605.09999990463,5,2122.0,128143.89999985695,,HRV,HRV_0085,2022-11-30 17:41:01
Ginseng ,4,"What plant takes its name for the Chinese words for ""man root""? ",245,0.801,13,128143.89999985695,p,K,3657.5,,,,,133120.39999985695,,HRV,HRV_0085,2022-11-30 17:41:01
The Super Bowl ,2,What rubber Wham-O toy inspired the name of one of the world's largest sporting events? ,255,1.956,14,133120.79999995232,p,K,5482.900000095367,,,,,141077.09999990463,,HRV,HRV_0085,2022-11-30 17:41:01
On a Jell-O box,6,"Where would you see the consumer warning ""Do not use fresh or frozen pineapple, kiwi, ginger-root, papaya, figs, or guava""?",411,0.87,15,141077.09999990463,p,K,6309.200000047684,,,,,148786.79999995232,,HRV,HRV_0085,2022-11-30 17:41:01
Louie Louie,4,What 1963 song led to a thirty-one month FBI investigation into supposed obscenities hidden in its unintelligible lyrics?,122,1.698,16,148786.89999985695,p,K,5501.5,,,,,156522.70000004768,,HRV,HRV_0085,2022-11-30 17:41:01
South Africa,1,In what country was the largest rough diamond ever discovered?,62,0.648,17,156522.79999995232,t,W,4476.599999904633,163529.59999990463,167545.39999985695,4,555.4000000953674,169282.29999995232,,HRV,HRV_0085,2022-11-30 17:41:01
Arthur Conan Doyle,2,"What gullible author believed that Harry Houdini had ""wonderful powers"" after Houdini showed him the child's trick of pretending to remove his thumb? ",184,1.087,18,169283.09999990463,,,,,,,,178815.09999990463,,HRV,HRV_0085,2022-11-30 17:41:01
Charles ,3,What river runs through Boston? ,252,1.349,19,178815.29999995232,p,K,2189.0999999046326,,,,,182875.39999985695,,HRV,HRV_0085,2022-11-30 17:41:01
Temple Prostitute,2,"Anciently, what was the job description of a ""hierodule""?",21,1.574,20,182875.5,t,W,4091.899999856949,189496.79999995232,193513.79999995232,5,944.9000000953674,196551.79999995232,,HRV,HRV_0085,2022-11-30 17:41:01
Pieces of Skylab fell there,4,"Why did the Shire of Esperance, in Western Australia, issue the United States a $400 fine for littering in 1979?",391,1.779,21,196551.79999995232,t,W,7419.299999952316,206495.89999985695,210518.29999995232,5,530.2999999523163,213361.70000004768,,HRV,HRV_0085,2022-11-30 17:41:01
Broccoli! ,1,Whice vegeteable has more vitamin C than an orange and as much calcium as whole milk?,456,0.932,22,213361.79999995232,p,K,7166.400000095367,,,,,221988.79999995232,,HRV,HRV_0085,2022-11-30 17:41:01
Let's spend some time together,1,"In 1967, what did The Ed Sullivan Show force the Rolling Stones to sing instead of the title of their song ""Let's Spend the Night Together""?",54,0.722,23,221989.29999995232,t,W,7459.200000047684,231980.29999995232,235998.70000004768,5,1472.3999998569489,238715.5,,HRV,HRV_0085,2022-11-30 17:41:01
Utah,6,"What US state advertised ""The Greatest Snow on Earth"" on its license plates? ",273,0.976,24,238715.89999985695,p,K,4621.900000095367,,,,,244835.70000004768,,HRV,HRV_0085,2022-11-30 17:41:01
Pandemonium,4,"What noisy word comes from the capital of Hell in Milton's ""Paradise Lost""? ",239,1.174,25,244835.89999985695,p,K,6462.200000047684,,,,,253023.79999995232,,HRV,HRV_0085,2022-11-30 17:41:01
Arkansas ,7,Where is the only active diamond mine in the U.S.?,320,0.956,26,253023.79999995232,p,K,3746.9000000953674,,,,,258246.09999990463,,HRV,HRV_0085,2022-11-30 17:41:01
Paris,2,"What city is home to the world's very first pet cemetery, in which Rin Tin Tin is buried?",148,1.895,27,258246.59999990463,t,W,5473.400000095367,266248.39999985695,270274.09999990463,5,1442.7000000476837,274138.2000000477,,HRV,HRV_0085,2022-11-30 17:41:01
Mountain Dew,7,"What was first marketed with hillbilly-themed advertising, since its name is a euphemism for moonshine?",421,1.302,28,274138.2000000477,p,K,7247.299999952316,,,,,283215.7000000477,,HRV,HRV_0085,2022-11-30 17:41:01
Quotations ,4,What did the letter Q originally stand for in NASDAQ?  ,165,1.218,29,283216.39999985695,p,K,4679.400000095367,,,,,289660.7000000477,,HRV,HRV_0085,2022-11-30 17:41:01
Nuclear Disarmament,1,"The famous ""peace symbol"" was designed to combine the semaphoe positions for N and D. What do the N and D stand for?",97,1.985,30,289660.7000000477,t,W,5852.0,298044.5,302072.59999990463,5,1790.9000000953674,306371.7000000477,,HRV,HRV_0085,2022-11-30 17:41:01
Mice,5,"After humans, what's the worlds most abundant mammal species?",16,0.842,31,306371.7999999523,p,K,5372.099999904633,,,,,313126.5,,HRV,HRV_0085,2022-11-30 17:41:01
Tuesday,1,Greeks consider which day of the week the unluckiest because it is the day that Constantinople fell in 1453? ,43,1.916,32,313126.59999990463,t,W,6714.900000095367,322376.39999985695,326403.09999990463,5,620.0,329461.7000000477,,HRV,HRV_0085,2022-11-30 17:41:01
Andy Kaufman,7,Who was banned from Saturday Night Live by viewer phone vote in 1982? ,376,1.756,33,329462.2000000477,t,W,5801.799999952316,337790.2999999523,341817.0,5,629.7000000476837,344724.59999990463,,HRV,HRV_0085,2022-11-30 17:41:01
Excalibur,1,"According to Thomas Malory, Sir Bedivere's last knightly act is to return what to a lake?",14,1.472,34,344724.7999999523,p,K,6509.5,,,,,353236.2999999523,,HRV,HRV_0085,2022-11-30 17:41:01
Tears,1,"At 6-8 weeks, babies start producing what? ",23,1.49,35,353236.39999985695,t,W,4495.0,360265.7000000477,364276.7999999523,5,1425.5,367702.89999985695,,HRV,HRV_0085,2022-11-30 17:41:01
Francisco Goya,7,"After a fever took his hearing, who painted his bleak ""Black Paintings"" in a house called Quinta del Sordo, Spanish for ""House of the Deaf Man""?",15,1.524,36,367703.09999990463,q,S,7976.600000143051,,,,,377727.89999985695,,HRV,HRV_0085,2022-11-30 17:41:01
Germany,4,Which European country was the first to produce decaffeinated coffee? ,412,1.118,37,377728.09999990463,p,K,3923.600000143051,,,,,383293.2999999523,,HRV,HRV_0085,2022-11-30 17:41:01
The Stanley Cup ,5,Where is Jacques Plante's name misspelled five of the six times it appears? ,318,1.552,38,383293.2999999523,p,K,5986.599999904633,,,,,391359.0,,HRV,HRV_0085,2022-11-30 17:41:01
The bishop,4,Which chess piece was originally called 'the elephant'? ,334,1.864,39,391359.2999999523,p,K,3659.2999999523163,,,,,397397.89999985695,,HRV,HRV_0085,2022-11-30 17:41:01
Tobacco,7,"In 2005, Bhutan became the first country to entirely ban what?",57,0.91,40,397397.89999985695,q,S,6111.400000095367,,,,,404934.5,,HRV,HRV_0085,2022-11-30 17:41:01
Orville Wright,1,Who was flying the plane in which the first US airplane fatality occurred? ,377,1.465,41,404934.5,p,K,5065.700000047684,,,,,411985.7999999523,,HRV,HRV_0085,2022-11-30 17:41:01
Bed ,2,"Shakespeare mentioned his wife only once in his will, making her the odd bequest of his ""second best"" what? ",82,1.766,42,411986.2999999523,,,,,,,,421521.09999990463,,HRV,HRV_0085,2022-11-30 17:41:01
Harmonica,7,"What's sometimes called a ""licking stick"" or a ""tin sandwich""?  ",301,0.729,43,421521.09999990463,p,K,5669.700000047684,,,,,428459.0,,HRV,HRV_0085,2022-11-30 17:41:01
Tse-tse fly,5,What transmits the disease typanosomiasis to humans and cattle? ,267,0.888,44,428459.2000000477,p,K,5710.899999856949,,,,,435595.0,,HRV,HRV_0085,2022-11-30 17:41:01
Rechargeable batteries,3,"Three quarters of the cadmium mined annually is used, with nickel, to make what household items?",117,1.776,45,435595.2000000477,p,K,6236.699999809265,,,,,444141.2999999523,,HRV,HRV_0085,2022-11-30 17:41:01
Adding olive juice,5,What turns a plain martini into a dirty martini?,440,1.657,46,444141.2999999523,p,K,2460.4000000953674,,,,,448787.59999990463,,HRV,HRV_0085,2022-11-30 17:41:01
George VI,6,Who was the last British Monarch to also be an emperor?  ,381,1.898,47,448787.59999990463,p,K,4960.900000095367,,,,,456174.09999990463,,HRV,HRV_0085,2022-11-30 17:41:01
Asparagus,4,what vegetable loses its flavour the quickest?,451,1.343,48,456174.09999990463,t,W,3606.5,462295.39999985695,466311.2999999523,5,813.7999999523163,468994.2000000477,,HRV,HRV_0085,2022-11-30 17:41:01
Camel,7,Which animal's milk does not curdle? ,328,1.082,49,468994.2000000477,p,K,3136.5999999046326,,,,,473739.2000000477,,HRV,HRV_0085,2022-11-30 17:41:01
honey,4,Which is the only food that can never go off or go bad?,442,1.951,50,473739.2999999523,t,W,5916.5,482174.2000000477,486188.2000000477,5,1368.6999998092651,490029.59999990463,,HRV,HRV_0085,2022-11-30 17:41:01
Pinko,1,What five-letter word did Time magazine coin in 1926 to refer to left-leaners? ,177,1.41,51,490029.59999990463,t,W,6062.900000095367,498615.39999985695,502631.2999999523,5,1742.0999999046326,506301.89999985695,,HRV,HRV_0085,2022-11-30 17:41:01
Toledo,6,"The world's first ""sister cities"" were what Spanish city and its midwestern namesake?",110,1.172,52,506302.2000000477,p,K,4782.199999809265,,,,,512782.7000000477,,HRV,HRV_0085,2022-11-30 17:41:01
UFOs,5,What was studied by Project Blue Book?   ,279,0.614,53,512782.7999999523,p,K,2189.7999999523163,,,,,516108.5,,HRV,HRV_0085,2022-11-30 17:41:01
Green Eggs and Ham,3,What 1960 classic originated when Bennett Cerf bet one of his authors that he couldn't write a book using only fifty words?,419,1.491,54,516108.7000000477,t,W,7831.0,526463.399999857,530491.5999999046,5,1478.6000001430511,533986.399999857,,HRV,HRV_0085,2022-11-30 17:41:01
Bacon,7,"In Britain, what kind of meat comes in rashers?",397,1.479,55,533986.5,p,K,2495.0,,,,,538490.7999999523,,HRV,HRV_0085,2022-11-30 17:41:01
Oklahoma,3,"What U.S. state has the slogan ""Native America"" on its license plates?",271,0.814,56,538491.0999999046,p,K,4601.400000095367,,,,,544424.7000000477,,HRV,HRV_0085,2022-11-30 17:41:01
Untethered space walk,6,Challenger Astronaut Bruce McCandless II became Earth's first human to ever do what?,31,1.506,57,544424.7999999523,q,S,6729.0,,,,,553188.0999999046,,HRV,HRV_0085,2022-11-30 17:41:01
Coca-Cola,4,"""Project Kansas"" was the name for the top secret 1985 attempt to revamp what product?",416,0.645,58,553188.0999999046,t,W,5966.600000143051,561679.7999999523,565706.7999999523,5,592.9000000953674,567479.5,,HRV,HRV_0085,2022-11-30 17:41:01
Theodore Roosevelt ,5,"What former president coined the phrase ""lunatic fringe"" to refer to the wackos in his own reform movement?",178,0.767,59,567479.5,p,K,3897.0999999046326,,,,,572673.399999857,,HRV,HRV_0085,2022-11-30 17:41:01
Martin Luther King Jr. ,7,Who won the Nobel Peace Prize in 1964? ,386,1.593,60,572673.5999999046,p,K,3998.7999999523163,,,,,578802.5,,HRV,HRV_0085,2022-11-30 17:41:01
Espresso,7,The Italian government regulates the price of what beverage?,399,0.908,61,578803.0,p,K,4537.200000047684,,,,,584779.7000000477,,HRV,HRV_0085,2022-11-30 17:41:01
Great Britain,1,"Of the world's seven most populous islands, what's the only one not in Asia? ",76,1.155,62,584779.7000000477,p,K,6552.699999809265,,,,,593011.399999857,,HRV,HRV_0085,2022-11-30 17:41:01
popscicle,6,What food was invented by an 11 year old in 1905?,450,0.901,63,593011.399999857,p,K,5300.900000095367,,,,,599740.899999857,,HRV,HRV_0085,2022-11-30 17:41:01
Bile,4,"Two of the ""four humors"" the ancients believed controlled temperament consist of what bodily fluid?",118,0.995,64,599741.0999999046,p,K,6903.100000143051,,,,,608162.5999999046,,HRV,HRV_0085,2022-11-30 17:41:01
