QuestionNum,Question,Answer,exp,subjectId,date
1,Have you eaten anything since our last meal? ,a bit,HRV,HRV_0052,2022-11-30 18:15:48
2,How often do you work out?,4-5 times a week,HRV,HRV_0052,2022-11-30 18:15:48
3,How would you best describe your current diet?,Not strict but generally try to maintain healthy diet,HRV,HRV_0052,2022-11-30 18:15:48
4,"We want to check that you are paying attention, please select ""Moderately"" as your answer.",Moderately,HRV,HRV_0052,2022-11-30 18:15:48
5,How tired do you feel?,Moderately,HRV,HRV_0052,2022-11-30 18:15:48
6,How strong is your desire to eat right now?,Moderately,HRV,HRV_0052,2022-11-30 18:15:48
7,How much do you think you could eat right now?,A small meal,HRV,HRV_0052,2022-11-30 18:15:48
