Answer,C_Pay,Question,QuestionNum,jitter,C_Trial,C_QPresent,rsp,C_SWK,C_SWK_rt,C_TrialEnd,exp,subjectId,date
Juvenile deliquent,4,What did popular author J.D. Salinger reveal the first two intials in his name to stand for?  ,163,1.358,131,545550.1000000238,q,S,2983.100000023842,550400.2000000477,HRV,HRV_0070,2022-11-30 17:50:08
Sao Paulo,2,What's the most populous city in the Southern Hemisphere?,304,1.799,132,550400.2999999523,q,S,1715.0,554424.3999999762,HRV,HRV_0070,2022-11-30 17:50:08
Adding olive juice,1,What turns a plain martini into a dirty martini?,440,1.606,133,554424.6000000238,q,S,1601.3999999761581,558141.2000000477,HRV,HRV_0070,2022-11-30 17:50:08
Joeys,3,What are infant marsupials called?  ,135,1.118,134,558141.2000000477,q,S,3176.7999999523163,562944.8999999762,HRV,HRV_0070,2022-11-30 17:50:08
Paris,7,"Student protests in which capital city inspired John Lennon's song  ""Revolution""? ",86,0.863,135,562944.8999999762,q,S,2656.600000023842,566975.0,HRV,HRV_0070,2022-11-30 17:50:08
Dorito is Spanish for little golden things,6,What does Dorito actually mean?,434,1.791,136,566975.0,q,S,1520.2999999523163,570795.5,HRV,HRV_0070,2022-11-30 17:50:08
Ciabatta,1,"What sandwich bread, because of its shape, takes its name from the Italian for ""carpet slipper""? ",406,1.707,137,570795.5,q,S,2014.1000000238419,575024.7999999523,HRV,HRV_0070,2022-11-30 17:50:08
A red giant ,2,"What kind of enormous, cool star will our own sun become in five billion years? ",224,1.452,138,575024.7999999523,q,S,2452.3000000715256,579437.7000000477,HRV,HRV_0070,2022-11-30 17:50:08
lobster,2,Which expensive restaurant item used to be fed to pisinors and servants?,449,1.141,139,579437.7000000477,q,S,2940.1999999284744,584028.1000000238,HRV,HRV_0070,2022-11-30 17:50:08
Chicago,7,What city has the only drive-thru post office in the world? ,147,1.033,140,584028.1000000238,q,S,2433.899999976158,588004.2000000477,HRV,HRV_0070,2022-11-30 17:50:08
Rafflesia (corpse lily) ,4,What is the largest flower in the world? ,204,1.711,141,588004.2000000477,q,S,2322.1999999284744,592546.0,HRV,HRV_0070,2022-11-30 17:50:08
Adobe,7,"What word for mud bricks comes to us from the ancient Egyptian word ""dbt""? ",298,1.308,142,592546.0,q,S,2057.100000023842,596420.6000000238,HRV,HRV_0070,2022-11-30 17:50:08
Lhasa Apso,5,"What is called the ""bark lion sentinel dog"" in its native Tibet?  ",200,1.726,143,596420.6000000238,q,S,2259.100000023842,600914.7000000477,HRV,HRV_0070,2022-11-30 17:50:08
