QuestionNum,Question,Answer,exp,subjectId,date
1,Have you eaten anything since our last meal? ,Not at all,HRV,HRV_0124,2022-11-30 18:19:22
2,How often do you work out?,2-3 times a week,HRV,HRV_0124,2022-11-30 18:19:22
3,How would you best describe your current diet?,Not strict but generally try to maintain healthy diet,HRV,HRV_0124,2022-11-30 18:19:22
4,"We want to check that you are paying attention, please select ""Moderately"" as your answer.",Moderately,HRV,HRV_0124,2022-11-30 18:19:22
5,How tired do you feel?,Slightly,HRV,HRV_0124,2022-11-30 18:19:22
6,How strong is your desire to eat right now?,Not at all,HRV,HRV_0124,2022-11-30 18:19:22
7,How much do you think you could eat right now?,Nothing,HRV,HRV_0124,2022-11-30 18:19:22
