QuestionNum,Question,Answer,exp,subjectId,date
1,Have you eaten anything since our last meal? ,Not at all,HRV,HRV_0315,2022-11-30 22:56:43
2,How often do you work out?,Almost daily,HRV,HRV_0315,2022-11-30 22:56:43
3,How would you best describe your current diet?,Strict for losing weight,HRV,HRV_0315,2022-11-30 22:56:43
4,"We want to check that you are paying attention, please select ""Moderately"" as your answer.",Moderately,HRV,HRV_0315,2022-11-30 22:56:43
5,How tired do you feel?,Slightly,HRV,HRV_0315,2022-11-30 22:56:43
6,How strong is your desire to eat right now?,Not at all,HRV,HRV_0315,2022-11-30 22:56:43
7,How much do you think you could eat right now?,A light snack,HRV,HRV_0315,2022-11-30 22:56:43
